video_id,contestant,question,options,correct_answer,contestant_answer,category,level,amount,joker_used,is_correct,eliminated
ghmCBhGxRNk,Contestant_210,Hangisi bitkisel değil hayvansal bir yağdır?,"['A) Palm yağı', 'B) Zeytin yağı', 'C) Tereyağı', 'D) Soya yağı']",C,C,Bilim,3,7500.0,yok,True,False
ghmCBhGxRNk,Contestant_210,Dinlediğiniz Uzaktan adlı şarkıyı seslendiren kimdir?,"['A) Göksel', 'B) Bengü', 'C) Aleyna Tilki', 'D) Nil Karaibrahimgil']",A,A,Müzik,4,10000.0,yok,True,False
ghmCBhGxRNk,Contestant_210,4'ün karekökü 4'ün karesinin nesidir?,"['A) Yarısı', 'B) Çeyreği', 'C) Çeyreğinin yarısı', 'D) Çeyreğinin çeyreği']",C,C,Matematik,5,20000.0,yok,True,False
ghmCBhGxRNk,Contestant_210,İtalya'nın başkenti Roma'nın içinden akan nehir hangisidir?,"['A) Vardar', 'B) Tiber', 'C) Tuna', 'D) Volga']",B,B,Coğrafya,6,30000.0,telefon,True,False
ghmCBhGxRNk,Contestant_210,"Hangisi Robert De Niro'nun oyuncusu, Martin Scorsese'nin yönetmeni olduğu filmlerden biri değildir?","['A) Taksi Şoförü', 'B) Sıkı Dostlar', 'C) İrlandalı', 'D) İngiliz Hasta']",D,B,Sanat,7,50000.0,yarı_yarıya,False,True
glI-cMo7gzE,Contestant_211,Türkiye'de Zafer Bayramı hangi gün kutlanır?,"['29 Ekim', '23 Nisan', '19 Mayıs', '30 Ağustos']",D,D,Tarih,1,1000.0,yok,True,False
glI-cMo7gzE,Contestant_211,çizme hangisinin bir çeşididir?,"['başlık', 'ayakkabı', 'eldiven', 'etek']",B,B,Genel Kültür,2,5000.0,yok,True,False
glI-cMo7gzE,Contestant_211,hangisi Sevinç bildirmek için kullanılan yaşa ünlemi ile eş anlamlıdır?,"['Hayda', 'Tüh', 'Oley', 'vah']",C,C,Genel Kültür,3,7500.0,yok,True,False
glI-cMo7gzE,Contestant_211,hangisi genellikle eski dostların aralarındaki ahbaplık vurgulamak için kullandıkları bir ifadedir?,"['hukukumuz vardır', 'tıbb vardır', 'mimarlığımız vardır', 'iktisad vardır']",A,A,Genel Kültür,4,10000.0,yok,True,False
glI-cMo7gzE,Contestant_211,Sabrina Carpenter Dinlediğiniz şarkının adı nedir?,"['karamel Maki', 'Americano', 'Latte', 'Espresso']",D,D,Müzik,5,20000.0,telefon,True,False
glI-cMo7gzE,Contestant_211,düz kanatlılar pul kanatlılar çift kanatlılar zar kanatlılar ve Kın kanatlılar hangi hayvanlardır?,"['Kuşlar', 'böcekler', 'Yarasalar', 'balıklar']",B,,Bilim,6,30000.0,seyirci,False,True
glI-cMo7gzE,Contestant_212,hangisi boynun arkasıdır?,"['ense', 'avuç', 'göbek', 'topuk']",A,A,Genel Kültür,1,1000.0,yok,True,False
glI-cMo7gzE,Contestant_212,yılın 5 ayı hangisinin sözlük tanımıdır?,"['Nisan', 'Mayıs', 'Haziran', 'Temmuz']",B,B,Genel Kültür,2,5000.0,yok,True,False
glI-cMo7gzE,Contestant_212,hangisi özel alaşım ve maddelerle Kurşun geçirmeyecek bir biçimde yapılmış üst giysisine verilen addır?,"['bakır kazak', 'bronz süveter', 'çelik yelek', 'Tunç hırka']",C,C,Genel Kültür,3,7500.0,yok,True,False
glI-cMo7gzE,Contestant_212,iki veya daha fazla kişi arasında dostça arkadaşça yapılan konuşma anlamına gelen Kelimenin doğru yazılışı hangisidir?,"['Sohbette', 'Sohbete', 'Sohbet', 'Sohbett']",C,C,Türkçe,4,10000.0,yok,True,False
glI-cMo7gzE,Contestant_212,Türkiye'de bir dönem Trabzonspor forması giymiş ikiz kardeşler shota ve Arçil arvel hangi ülkenin eski milli futbolcuları dır?,"['Gürcistan', 'Bulgaristan', 'Azerbaycan', 'Yunanistan']",A,A,Spor,5,20000.0,yok,True,False
glI-cMo7gzE,Contestant_212,kazandığı tek Altın Portakal en iyi erkek oyuncu ödülünü 1977'de Kapıcılar Kralı filmindeki rolüyle alan oyuncu kimdir?,"['şenerşen', 'İlyas Salman', 'şet altu', 'Kemal Sunal']",D,D,Sanat,6,30000.0,yok,True,False
glI-cMo7gzE,Contestant_212,sözleri Abdülhak Hamit Tarhan'ın Aynı adlı eserinden alınan Dinlediğiniz makber adlı şarkıyı kim seslendirmektedir?,"['Safi Ayla', 'Hamiyet Yüceses', 'Müzeyyen Senar', 'Behiye Aksoy']",B,A,Müzik,7,50000.0,telefon,False,True
glI-cMo7gzE,Contestant_213,Oley sözü hangi duyguları anlatmak için kullanılır?,"['kırgınlık ve Hüsran', 'kızgınlık ve öfke', 'hoşnutluk ve sevinç', 'huzursuzluk ve korku']",C,C,Genel Kültür,1,1000.0,yok,True,False
glI-cMo7gzE,Contestant_213,iş ilanlarında başvuracak adaylardan hangisine ayak uydurabilecek olması istenir?,"['bitmeyen geyik muhabbetine', 'yoğun iş temposuna', 'kısacık mesai saatlerine', 'Sık ve uzun molara']",B,B,Genel Kültür,2,5000.0,yok,True,False
glI-cMo7gzE,Contestant_213,marketlerde şalgam suyun çeşidi satılır?,"['yarım yağlı ve tam yağlı', 'laktozlu ve Laktozsuz', 'acılı ve Acısız', 'kurşunsuz ve dizel']",C,C,Genel Kültür,3,7500.0,yok,True,False
glI-cMo7gzE,Contestant_213,Apron adı verilen bir alanda yolcuyu indirip bindiren park eden ya da yakıt alan genellikle hangisi olur?,"['uçak', 'sal', 'kayık', 'Sandal']",A,A,Genel Kültür,4,10000.0,seyirci,True,False
glI-cMo7gzE,Contestant_213,2024 Paris olimpiyatlarında 10 metre havalı tabanca karışık takım kategorisinde Şevval İlayda Tarhan birlikte Gümüş madalya kazanarak atıcılıkta Türkiye'ye ilk olimpiyat madalyasını kazandıran kimdir?,"['met gazoz', 'Hakan Reçber', 'Taha Akgül', 'Yusuf dikeç']",D,D,Spor,5,20000.0,yok,True,False
glI-cMo7gzE,Contestant_213,Özdemir Erdoğan'dan Dinlediğiniz türkünün adı nedir?,"[""Sivas'ın Kangalları"", ""Ankara'nın keçileri"", ""Denizli'nin Horozları"", ""Karaman'ın koyunları""]",C,C,Müzik,6,30000.0,yok,True,False
glI-cMo7gzE,Contestant_213,hangi adı taşıyan sadece bir Osmanlı Padişahı vardır?,"['Orhan', 'Selim', 'Murat', 'Süleyman']",A,D,Tarih,7,50000.0,yok,False,True
glI-cMo7gzE,Contestant_214,Osmanlı Devleti'nin kurucusu kimdir?,"['OSM Gazi', 'Selçuk Bey', 'Alpaslan', 'Selahattin Eyyubi']",A,A,Tarih,1,1000.0,yok,True,False
glI-cMo7gzE,Contestant_214,akşama doğru ne demektir?,"['sabahleyin', 'gün doğumunda', 'öğleden önce', 'akşamüstü']",D,D,Genel Kültür,2,5000.0,yok,True,False
glI-cMo7gzE,Contestant_214,Bir Gemi veya uçağın gidiş yönü izleyeceği Yol onun nesidir?,"['güveri', 'kokpiti', 'mürettebatı', 'Rotası']",D,D,Genel Kültür,3,7500.0,yok,True,False
glI-cMo7gzE,Contestant_214,hangisine sıpa denir?,"['küçük boydaki Ata', 'Eşeğin yavrusuna', 'Hindinin erkeğine', '1 yaşındaki keçiye']",B,B,Genel Kültür,4,10000.0,yok,True,False
glI-cMo7gzE,Contestant_214,geçen aydan önceki ay Haziran ise önümüzdeki Aydan sonraki ay nedir?,"['Ağustos', 'Eylül', 'Ekim', 'Kasım']",C,C,Genel Kültür,5,20000.0,seyirci,True,False
glI-cMo7gzE,Contestant_214,hangisi ulusal bayrağında ejderha tasviri bulunan bir ülkenin adıdır?,"['ejderya', 'Cezir', 'Japonya', 'Galler']",D,D,Coğrafya,6,30000.0,telefon,True,False
glI-cMo7gzE,Contestant_214,Dinlediğiniz Müzik çalarken Türkan Şoray ve Kadir İnanır'ın dans ettiği bir sahne varsa izlediğiniz film hangisidir?,"['sel Boylum Al Yazmalım', 'Ah Nerede', 'Hanım', 'Mavi Boncuk']",C,A,Sinema,7,50000.0,yok,False,True
glI-cMo7gzE,Contestant_215,Hangisi bir bütünü ince ve yassı parçalara ayırarak kesmek anlamına gelir?,"['elmek', 'dilmek', 'deşmek', 'seçmek']",B,B,Türkçe,1,1000.0,yok,True,False
glI-cMo7gzE,Contestant_215,haftanın p ile başlayan günlerini Say diyen öğretmene öğrenci hangi cevabı verirse sözlüden yüksek not alacaktır?,"['pırasa patates patlıcan', 'potasyum platin Plütonyum', 'pazar pazartesi Perşembe', 'Pele platini popescu']",C,C,Genel Kültür,2,5000.0,yok,True,False
glI-cMo7gzE,Contestant_215,Dinlediğiniz Gemiler Döner geriyi adlı şarkıyı kim seslendirmektedir?,"['Erkin Koray', 'İlhan İrem', 'Cem Karaca', 'Barış Manço']",B,B,Müzik,3,7500.0,seyirci,True,False
glI-cMo7gzE,Contestant_215,bir sulu boya takımı alır palit üzerinde mavi ile hangi rengi eşit oranda karıştırırsanız yeşil elde edersiniz?,"['kırmızı', 'turuncu', 'sarı', 'Mor']",C,C,Sanat,4,10000.0,yarı_yarıya,True,False
glI-cMo7gzE,Contestant_215,atom altı parçacıklarından elektrik yüklü olmayan hangisidir?,"['nötron', 'pozitron', 'elektron', 'Proton']",A,A,Bilim,5,20000.0,yok,True,False
glI-cMo7gzE,Contestant_215,yönetmenliğini dervi Saim'in yaptığı 1996 yapımı tabutla röveşata adlı filmde baş karakter Mahsun'u kim canlandırmıştır?,"['Fikret kuşkan', 'Çetin Tekindor', 'Güven Kıraç', 'Ahmet Uğurlu']",D,D,Sinema,6,30000.0,telefon,True,False
glI-cMo7gzE,Contestant_215,bonse solo kariyerine başlamadan önce hangi Müzik grubunun üyesiydi?,"[""Destiny's Child"", 'Spice Girls', 'Backstreet Boys', 'K-Ci & JoJo']",A,A,Müzik,7,50000.0,yok,True,False
glI-cMo7gzE,Contestant_215,şantör ne demektir?,"['piyano çalan kişi', 'erkek şarkıcı', 'Şan hocası', 'Bestekar']",B,B,Dil,8,100000.0,çift_cevap,True,False
glI-cMo7gzE,Contestant_215,güneş sistemindeki en büyük ikinci uydu olan Titan hangisinin uydusudur?,"['Jüpiter', 'dünya', 'Satürn', 'Merkür']",C,,Bilim,9,200000.0,yok,False,True
glI-cMo7gzE,Contestant_216,halay oyunu oynanırken davulla birlikte çalınan enstrüman genellikle hangisi olur?,"['ukulele', 'kontrbas', 'Cello', 'zurna']",D,D,Müzik,1,1000.0,yok,True,False
glI-cMo7gzE,Contestant_216,Ünlü Sözde tarih için söylenen hangisidir?,"['tenkide kapalıdır', 'temennide bulunmaz', 'tekerrürden ibarettir', 'taahhütle doludur']",C,C,Genel Kültür,2,5000.0,yok,True,False
glI-cMo7gzE,Contestant_216,hangisi çocuk bilimci anlamına gelir?,"['jeolog', 'sosyolog', 'astrolog', 'pedagog']",D,D,Bilim,3,7500.0,yok,True,False
glI-cMo7gzE,Contestant_216,hangi Antik Kent İzmir il sınırları içerisinde yer alır?,"['Efes', 'Aspendos', 'Sagalassos', 'Asos']",A,A,Tarih,4,10000.0,seyirci,True,False
glI-cMo7gzE,Contestant_216,enstrümantal versiyonunu Dinlediğiniz şarkının adı nedir?,"['Sürgün', 'Ayrılık', 'Gül Güzeli', 'Aynalar']",B,B,Müzik,5,20000.0,yok,True,False
glI-cMo7gzE,Contestant_216,yabancı konukların yanına verilen onları gezdiren onlarla ilgilenen Kılavuz veya arkadaş anlamındaki kelime hangisidir?,"['vakanüvis', 'Bezirgan', 'Mihmandar', 'Kazasker']",C,C,Türkçe,6,30000.0,yarı_yarıya,True,False
glI-cMo7gzE,Contestant_216,Hangi klasik eserin yazarı Alexander Puşkin?,"['yüzbaşının kızı', 'Diriliş', ""Milena'ya Mektuplar"", 'hayvan çiftliği']",A,A,Edebiyat,7,50000.0,yok,True,False
glI-cMo7gzE,Contestant_216,Guinness dünya rekorlarına göre 1958 1959 arası gerçekleşen bir hava taşıtıyla yapılan en uzun süreli insanlı ve kesintisiz uçuş yaklaşık ne kadar sürmüştür?,"['65 saat', '6,5 gün', '650 saat', '65 gün']",D,B,Tarih,8,100000.0,"telefon, çift_cevap",False,True
glI-cMo7gzE,Contestant_217,vezir ve şah hangi masa oyunundaki iki taşa adını veren unvanlardan?,"['Satranç', 'Tavla', 'Okey', 'Dama']",A,A,Genel Kültür,1,1000.0,yok,True,False
glI-cMo7gzE,Contestant_217,kabak çıktı genellikle hangilerinin tatsız olduğunu belirtmek için kullanılan bir sözdür?,"['kurabiye ve yaş pasta', 'kabak çekirdeği ve kabak tatlısı', 'mercimek çorbası ve mantı', 'kavun ve karpuz']",D,D,Genel Kültür,2,5000.0,yok,True,False
glI-cMo7gzE,Contestant_217,29 harfli Türk alfabesindeki toplam sesli harf sayısı ve toplam sessiz harf sayısını topladığınızda sonuç kaç olur?,"['21', '29', '32', '37']",B,B,Türkçe,3,7500.0,yok,True,False
glI-cMo7gzE,Contestant_217,sabah karşılaştığınız İnsanların büyük çoğunluğu size Kalimera diyorsa Muhtemelen hangi ülkedesin?,"['Japonya', 'Güney Kore', 'Çin', 'Yunanistan']",D,D,Coğrafya,4,10000.0,yok,True,False
glI-cMo7gzE,Contestant_217,Tarlatan nedir?,"['karayolu onarım aracı', 'çiçeksiz bir bitki', 'bir tür iç giysisi', 'bir ağırlık ölçüsü']",C,C,Genel Kültür,5,20000.0,yarı_yarıya,True,False
glI-cMo7gzE,Contestant_217,müziğini Dinlediğiniz türkünün adı nedir?,"['Evlerinin önü yonca', 'Bir Fırtına Tuttu Bizi', 'Eklemedir Koca Konak', 'bülbülüm altın kafese']",D,D,Müzik,6,30000.0,yok,True,False
glI-cMo7gzE,Contestant_217,taşıl bilimi hangisinin tanımıdır?,"['paleontoloji', 'oşinografi', 'ornitoloji', 'taşoloji']",A,A,Bilim,7,50000.0,telefon,True,False
glI-cMo7gzE,Contestant_217,Türkiye'den bakan biri ayın kuzeyini gökyüzünde yukarıda görürken aynı anda Güney Afrika'dan bakan birinin ayın güneyini yukarıda görmesi hangisinin bariz bir kanıtıdır?,"['Dünyanın kendi etrafında dönüşünün', 'Dünyanın güneş etrafında dönüşünün', 'dünyanın şeklinin küresel olduğunun', 'dünyanın tepsi gibi düz olduğunun']",C,C,Bilim,8,100000.0,çift_cevap,True,False
glI-cMo7gzE,Contestant_217,hangi ilin karadenize kıyısı vardır?,"['Çanakkale', 'Tokat', 'Karabük', 'Tekirdağ']",B,B,Coğrafya,9,200000.0,seyirci,False,True
GlWdWnY63lM,Contestant_218,Hangisi sözlükte tanımı olan bir ifade değildir?,"['A) söz yüzüğü', 'B) nişan yüzüğü', 'C) evlilik yüzüğü', 'D) Ayrılık yüzüğü']",D,D,Genel Kültür,1,1000.0,yok,True,False
GlWdWnY63lM,Contestant_218,Ağaç işleriyle uğraşan ve ağaçtan çeşitli eşya yapanların mesleği nedir?,"['A) tellaklık', 'B) marangozluk', 'C) çiftçilik', 'D) terzilik']",B,B,Genel Kültür,2,5000.0,yok,True,False
GlWdWnY63lM,Contestant_218,Kızınca tüküren hayvan şeklinde sorulmuş bir bulmaca sorusunun cevabı hangisi olur?,"['A) hamsi', 'B) eşe karısı', 'C) Lama', 'D) anakonda']",C,C,Genel Kültür,3,7500.0,yok,True,False
GlWdWnY63lM,Contestant_218,Hangi mutfak gerecinin kendine has bir tokmağı olur?,"['A) havan', 'B) nihale', 'C) Kevgir', 'D) ilistir']",A,A,Genel Kültür,4,10000.0,yok,True,False
GlWdWnY63lM,Contestant_218,Bir yorumunu Dinlediğiniz araba adlı şarkının sözlerinde hangisi geçmez?,"['A) özel mi özel', 'B) iner mi iner', 'C) güzel mi güzel', 'D) gider mi gider']",B,B,Müzik,5,20000.0,yok,True,False
GlWdWnY63lM,Contestant_218,"Başrolünde Daniel Craig'in olduğu Casino Royale, Skyfall ve No Time To Die adlı filmler hangi film serisindendir?","['A) İndiana Jones', 'B) Sherlock Holmes', 'C) Star Wars', 'D) James Bond']",D,D,Sinema,6,30000.0,"seyirci, yarı_yarıya",True,False
GlWdWnY63lM,Contestant_218,Triton hangisinin en büyük uydusudur?,"['A) Pluton', 'B) dünya', 'C) Satürn', 'D) Neptün']",D,C,Bilim,7,50000.0,telefon,False,True
GlWdWnY63lM,Contestant_219,Bana kül yutturamazsın diyen biri hangi mesajı vermiş olur?,"['A) beni görebilirsiniz', 'B) Beni oyuna getiremezsiniz', 'C) düşürebilirsiniz', 'D) beni hor görebilirsiniz']",B,B,Genel Kültür,1,1000.0,yok,True,False
GlWdWnY63lM,Contestant_219,Çağan Irmak'ın yönettiği hangi adlı bir film vardır?,"['A) eniştem ve kayınçom', 'B) eltim ve Görümcem', 'C) baldızım ve bacanağım', 'D) Babam ve Oğlum']",D,D,Sinema,2,5000.0,seyirci,True,False
GlWdWnY63lM,Contestant_219,Çünkü sen artık bir yabancısın şeklinde biten duvar yazısının başı nasıldır?,"['A) herkese karamel mak sana çay', 'B) herkese mayami sana Bağcılar', 'C) herkese şat biryan sana lahmacun', 'D) Herkese günaydın sana Good morning']",D,D,Genel Kültür,3,7500.0,yok,True,False
GlWdWnY63lM,Contestant_219,Emrah der ki düştüm dile Bülbül figan eder güle güzel Sevmek bir Sarp Kale ya alınır ya alınmaz dizeleri hangi halk ozanına aittir?,"['A) Erzurumlu Emrah', 'B) Aşık Veysel', 'C) Dadaloğlu', 'D) Karacaoğlan']",A,A,Edebiyat,4,10000.0,telefon,True,False
GlWdWnY63lM,Contestant_219,Anadolu'nun birçok yöresinde çok üşüdüm dondum anlamında söylenen hangisidir?,"['A) aydım', 'B) buydum', 'C) Caydım', 'D) duydum']",B,B,Genel Kültür,5,20000.0,yarı_yarıya,True,False
GlWdWnY63lM,Contestant_219,1990'da ABD müzik listelerinde birinci sıraya çıkan Dinlediğiniz Ice Ice Baby adlı şarkıyı kim seslendirmektedir?,"['A) Ice Cube', 'B) Ice T', 'C) Vanilla Ice', 'D) Eminem']",C,D,Müzik,6,30000.0,yok,False,True
GlWdWnY63lM,Contestant_220,Sözü edilen bir şey hakkında yorum yapılırken 'Eh işte' dendikten sonra genellikle hangisi söylenir?,"['A) eksiksiz', 'B) kusursuz', 'C) harkulade', 'D) fena değil']",D,D,Genel Kültür,1,1000.0,yok,True,False
GlWdWnY63lM,Contestant_220,Güneşin batmasına yakın zamandan gecenin başlamasına kadar geçen zaman dilimi hangisinin tanımıdır?,"['A) akşam', 'B) öğle', 'C) sabah', 'D) Seher']",A,A,Genel Kültür,2,5000.0,yok,True,False
GlWdWnY63lM,Contestant_220,Pinpon genellikle hangisiyle oynanır?,"['A) istekalarla', 'B) lobutlarla', 'C) raketle', 'D) kılıçla']",C,C,Spor,3,7500.0,yok,True,False
GlWdWnY63lM,Contestant_220,Ardışık 5 çift doğal sayıdan en küçüğü en büyüğünden kaç eksiktir?,"['A) 6', 'B) 8', 'C) 10', 'D) 12']",B,B,Matematik,4,10000.0,seyirci,True,False
GlWdWnY63lM,Contestant_220,Taksim Trio'nun enstrümental bir versiyonunu Dinlediğiniz şarkının adı nedir?,"['A) Kurşun Adres Sormaz Ki', 'B) İkimizin Yerine', 'C) Tutamıyorum Zamanı', 'D) Kır Zincirlerini']",A,A,Müzik,5,20000.0,yok,True,False
GlWdWnY63lM,Contestant_220,Jeomorfoloji ne demektir?,"['A) yüzey bilimi', 'B) zaman bilimi', 'C) yazıt bilimi', 'D) uzay bilimi']",A,A,Bilim,6,30000.0,yok,True,False
GlWdWnY63lM,Contestant_220,Türkiye'den hangi Sınır Kapısı üzerinden çıkarsanız Azerbaycan'a bağlı Özerk Bir Cumhuriyet olan Nahçıvan'a girmiş olursunuz?,"['A) İpsala', 'B) Türkgözü', 'C) Dilucu', 'D) Pazarkule']",C,C,Coğrafya,7,50000.0,"yarı_yarıya, telefon",True,False
GlWdWnY63lM,Contestant_220,Dünyanın da içinde bulunduğu Samanyolu Galaksisi'nin merkezinde yer alan Sagittarius A* hangisidir?,"['A) dev bir cüce Yıldız', 'B) dev bir gezegen', 'C) dev bir kuasar', 'D) dev bir karadelik']",D,D,Bilim,8,100000.0,çift_cevap,True,False
GlWdWnY63lM,Contestant_220,1288'de Fransa'nın Autun kasabasında kurulan mahkemede Kasaba'nın tüm arpa mahsulünü yemekten yargılanan ve avukatının başarılı savunması sonucunda ceza almayanlar hangisidir?,"['A) tavuklar', 'B) Kargalar', 'C) Fareler', 'D) çekirgeler']",C,,Tarih,9,200000.0,yok,False,False
GlWdWnY63lM,Contestant_221,A Rh pozitif cevabını veren birine muhtemelen hangisi sorulmuştur?,"['A) kan grubunuz nedir', 'B) Medeni haliniz nedir', 'C) Kaç doğumlusun', 'D) ne işle meşgulsünüz']",A,A,Genel Kültür,1,1000.0,yok,True,False
GlWdWnY63lM,Contestant_221,Genellikle hangisi esnasında sessizlik istenir?,"['A) rock konseri', 'B) derbi maçı', 'C) mevlit gecesi', 'D) sınav']",D,D,Genel Kültür,2,5000.0,yok,True,False
GlWdWnY63lM,Contestant_221,Vejetaryenler genel olarak hangisini tüketmez?,"['A) meyve', 'B) sebze', 'C) tahıl', 'D) kırmızı et']",D,D,Genel Kültür,3,7500.0,yok,True,False
GlWdWnY63lM,Contestant_221,Dinlediğiniz 'Rüyalar Gerçek Olsa' adlı şarkıyı kim seslendirmektedir?,"['A) Emel Sayın', 'B) Burcu Güneş', 'C) Zerrin Özer', 'D) Reyhan Karaca']",A,A,Müzik,4,10000.0,yok,True,False
GlWdWnY63lM,Contestant_221,"Ferhunde, Şevket, Necla ve Leyla hangi romanda yer alan karakterlerdir?","['A) Aşk-ı Memnu', 'B) Sinekli Bakkal', 'C) Yaprak Dökümü', 'D) Küçük Ağa']",C,C,Edebiyat,5,20000.0,yok,True,False
GlWdWnY63lM,Contestant_221,Taşan'a alışveriş yaptıktan sonra Zile Kalesi'ne gittiyseniz neredesinizdir?,"['A) Kastamonu', 'B) Tokat', 'C) Sinop', 'D) Samsun']",B,B,Coğrafya,6,30000.0,yok,True,False
GlWdWnY63lM,Contestant_221,"Kaptan Kanca tiyatro oyunu, kitap, film ve çizgi filmlerde yer alan hangi kurgusal karakterin baş düşmanıdır?","['A) Pinokyo', 'B) Tom Sawyer', 'C) Peter Pan', 'D) Pollyanna']",C,C,Edebiyat,7,50000.0,"telefon, seyirci",True,False
GlWdWnY63lM,Contestant_221,Avuç içleri kendisine dönük ve parmak uçları yukarı bakacak şekilde ellerine bakan biri için nişanda taktığı alyans sağdan kaçıncı sıradaki parmağında?,"['A) 3', 'B) 4', 'C) 7', 'D) 8']",C,B,Genel Kültür,8,100000.0,yarı_yarıya,False,False
GlWdWnY63lM,Contestant_221,Altın elementinin sembolü Au'nun açılımı olan Latince 'aurum' kelimesi ne anlama gelir?,"['A) ışıldayan', 'B) kırılmayan', 'C) esnek', 'D) yok olmayan']",A,A,Bilim,9,200000.0,çift_cevap,True,False
GlWdWnY63lM,Contestant_221,Türkiye'de ilk olarak hangi yıla ait toplam nüfus bilgisi adrese dayalı nüfus kayıt sistemi ile ölçülmüştür?,"['A) 1997', 'B) 2007', 'C) 2017', 'D) 2027']",B,A,Tarih,10,300000.0,yok,False,True
GlWdWnY63lM,Contestant_222,Hangisi üzerine oturulup sallanılan bir eğlence aracıdır?,"['A) salamura', 'B) salamanje', 'C) salyangoz', 'D) salıncak']",D,D,Genel Kültür,1,1000.0,yok,True,False
GlWdWnY63lM,Contestant_222,Hangisi bir atasözüdür?,"['A) eti senin kemiği benim', 'B) havyarı benim kılçığı senin', 'C) çekirdeği de Kabuğu da senin', 'D) köpüğü de telisi de benim']",A,A,Edebiyat,2,5000.0,yok,True,False
GlWdWnY63lM,Contestant_222,Okullardaki tarih derslerinde 'Beylikten Devlete' adlı ünite başlığı altında işlenen Osmanlılar'ın hangi dönemi olur?,"['A) duraklama dönemi', 'B) gerileme dönemi', 'C) kuruluş dönemi', 'D) dağılma dönemi']",C,C,Tarih,3,7500.0,yok,True,False
GlWdWnY63lM,Contestant_222,"Günümüzdeki profesyonel basketbol maçlarında topun çemberin içinden bir kez geçmesiyle kazanılabilen en yüksek sayı, en düşük sayıdan kaç fazladır?","['A) 4', 'B) 3', 'C) 2', 'D) 1']",C,D,Spor,4,10000.0,yok,False,True
GlWdWnY63lM,Contestant_223,"Pişmiş toprak ve plastik benzeri malzemelerden yapılan, çiçek yetiştirilmekte kullanılan kap hangisidir?","['A) semaver', 'B) mikser', 'C) saksı', 'D) mangal']",C,C,Genel Kültür,1,1000.0,yok,True,False
GlWdWnY63lM,Contestant_223,"'Koş oğlum, yakala getir topu, aferin benim kızıma' gibi sözlerin muhatabı genellikle hangisi olur?","['A) Japon balıkları', 'B) dinozorlar', 'C) köpekler', 'D) robot süpürgeler']",C,C,Genel Kültür,2,5000.0,yok,True,False
GlWdWnY63lM,Contestant_223,Kapüşon hangisinin çeşididir?,"['A) eldiven', 'B) başlık', 'C) ayakkabı', 'D) etek']",B,B,Genel Kültür,3,7500.0,yok,True,False
GlWdWnY63lM,Contestant_223,Hangisinin diğer adı sıcaklık ölçer?,"['A) termometre', 'B) kronometre', 'C) dinamometre', 'D) hidrometre']",A,A,Bilim,4,10000.0,yok,True,False
GlWdWnY63lM,Contestant_223,"'Pijamalı hasta Yağız şoföre çabucak Güvendi' cümlesi, 29 harfli Türk alfabesinde yer alan toplam kaç farklı harf kullanılarak yazılmıştır?","['A) 14', 'B) 19', 'C) 24', 'D) 29']",D,D,Genel Kültür,5,20000.0,seyirci,True,False
GlWdWnY63lM,Contestant_223,Sözü ve bestesi Teoman'a ait olan Dinlediğiniz 'Islak Islak' adlı şarkıyı kim seslendirmektedir?,"['A) Emre Aydın', 'B) Barış Akarsu', 'C) Ferman Akgül', 'D) Teoman']",B,B,Müzik,6,30000.0,yok,True,False
GlWdWnY63lM,Contestant_223,"Satürn, Uranüs ve Neptün'ün Güneş'e en uzak olandan en yakın olana doğru sıralanışı nasıldır?","['A) Uranüs Neptün Satürn', 'B) Satürn Uranüs Neptün', 'C) Neptün Uranüs Satürn', 'D) Uranüs Satürn Neptün']",C,,Bilim,7,50000.0,"telefon, yarı_yarıya",False,False
GlWdWnY63lM,Contestant_224,Yarışmakta olduğunuz Kim Milyoner Olmak İster adlı televizyon programında kullanılabilen joker hakları arasında hangisi yoktur?,"['A) telefon', 'B) yarı yarıya', 'C) çift cevap', ""D) Kenan Bey'e sorma""]",D,D,Genel Kültür,1,1000.0,yok,True,False
GlWdWnY63lM,Contestant_224,Hangisi ders esnasında öğretmenlerden duyulabilen klasikleşmiş bir uyarıdır?,"['A) çizdiyseniz çıkıyorum', 'B) uçtuysanız kaçıyorum', 'C) yazdıysanız siliyorum', 'D) sildiyseniz süpürüyorum']",C,C,Genel Kültür,2,5000.0,yok,True,False
GlWdWnY63lM,Contestant_224,Öğleden sonra 2 matinesine biletiniz varsa gideceğiniz etkinlik hangisi olabilir?,"['A) futbol maçı', 'B) sinema filmi', 'C) hentbol maçı', 'D) basketbol maçı']",B,B,Genel Kültür,3,7500.0,seyirci,True,False
GlWdWnY63lM,Contestant_224,Hangi kelimede nispet eki vardır?,"['A) simitçi', 'B) ekşimsi', 'C) 7.', 'D) resmi']",D,D,Edebiyat,4,10000.0,yok,True,False
GlWdWnY63lM,Contestant_224,Koala'nın ana vatanı neresidir?,"['A) Avustralya', 'B) Güney Amerika', 'C) Afrika', 'D) Kuzey Amerika']",A,A,Coğrafya,5,20000.0,telefon,True,False
GlWdWnY63lM,Contestant_224,"Hangisi henüz uluslararası turnuvaları düzenlenmemiş, olimpiyatlarda yer almamış ama gelecekte var olma ihtimali yüksek bir spor dalıdır?","['A) erkekler serbest güreş', 'B) erkekler grekoromen güreş', 'C) kadınlar serbest güreş', 'D) kadınlar grekoromen güreş']",D,D,Spor,6,30000.0,yarı_yarıya,True,False
GlWdWnY63lM,Contestant_224,Dinlediğiniz Domina Dancing adlı şarkıyı hangi grup seslendirmektedir?,"['A) Pet Shop Boys', 'B) Ace of Base', 'C) Roxette', 'D) Aqua']",A,,Müzik,7,50000.0,yok,False,False
I_quFrbu2qA,Contestant_225,"Bazıları et obur, bazıları otobur, bazıları da hepil olur diyen biri hangisinden bahsetmektedir?","['A) arabalar', 'B) burçlar', 'C) hayvanlar', 'D) gezegenler']",C,C,Genel Kültür,1,0.0,yok,True,False
I_quFrbu2qA,Contestant_225,Kovboy ve Kızılderili hikayelerinin geçtiği Hollywood filmlerinin mekanı olan yerin adında vahşi sıfatıyla birlikte hangi yön adı geçer?,"['A) Doğu', 'B) Batı', 'C) Kuzey', 'D) Güney']",B,B,Genel Kültür,2,0.0,yok,True,False
I_quFrbu2qA,Contestant_225,Biçerdöverle biçilip dövülen genellikle hangisi olur?,"['A) Cam eşyalar', 'B) kumaşlar', 'C) porselenler', 'D) Ekinler']",D,D,Genel Kültür,3,0.0,yok,True,False
I_quFrbu2qA,Contestant_225,Bir bulmacada bir doğal sayı şeklindeki sorunun iki harfli cevabının ilk harfi Ü değilse nedir?,"['A) A', 'B) İ', 'C) O', 'D) U']",C,A,Matematik,4,0.0,yok,False,True
I_quFrbu2qA,Contestant_226,Güzel sesle neşeyle konuşmak anlamına gelen deyim hangisidir?,"['A) tavuk gibi gıdaklamak', 'B) Arı gibi vızıldamak', 'C) karga gibi gaklamak', 'D) bülbül gibi şakımak']",D,D,Edebiyat,1,0.0,yok,True,False
I_quFrbu2qA,Contestant_226,Alışveriş listesi tarçın kimyon zencefil kekik kişniş şeklinde olan birinin gideceği yer hangisi olabilir?,"['A) aktar', 'B) manifaturacı', 'C) Nalbur', 'D) hırdavatçı']",A,A,Genel Kültür,2,0.0,yok,True,False
