video_id,contestant,question,options,correct_answer,contestant_answer,category,level,amount,joker_used,is_correct,eliminated
rEk4tCkFdIQ,Contestant_327,Uçaklarda yapılan anonslarda yolculara hitaben kullanılan sözler arasında genellikle hangisi olmaz,"['A) hanımefendiler', 'B) beyefendiler', 'C) sevgili çocuklar', 'D) sayın seyirciler']",D,D,Genel Kültür,2,5000.0,yok,True,False
rEk4tCkFdIQ,Contestant_327,rahatına düşkün birinden bahsedilirken söylenen hangisi olur,"['A) ağır başlı', 'B) tez canlı', 'C) Kadir Şinaz', 'D) ehl keyif']",D,D,Genel Kültür,3,7500.0,yok,True,False
rEk4tCkFdIQ,Contestant_327,Hollywood karakteri Dünya ağırsiklet boks şampiyonu rock'ın lakabı nedir,"['A) İtalyan aygırı', 'B) Napoli beygiri', 'C) sicil y katırı', 'D) Milo eşeği']",A,A,Sanat,4,10000.0,seyirci,True,False
rEk4tCkFdIQ,Contestant_327,Dinlediğiniz kadık adı kimdir,"['A) Cengiz Kurtoğlu', 'B) Adnan şensez', 'C) Sinan Özen', 'D) Ferhat Güzel']",B,B,Müzik,5,20000.0,yok,True,False
rEk4tCkFdIQ,Contestant_327,Hangisi bir davul türüdür,"['A) rebap', 'B) obua', 'C) nakkare', 'D) Cümbüş']",C,,Müzik,6,30000.0,telefon,False,True
rjQEjFrLZVU,Contestant_328,Türkiye'de yoğun kar yağışı altında oynanacak olan futbol maçlarında normalden farklı olarak genellikle hangisi yapılır?,"[""A) Antartika'dan özel hakem atanır"", 'B) Penaltı noktalarına kardan adam konulur', 'C) Kırmızı veya Turuncu Top kullanılır', 'D) Tribünlere karsambaç ve bici bici dağıtılır']",C,C,Spor,1,0.0,yok,True,False
rjQEjFrLZVU,Contestant_328,Hangisi kabuklu ve eklem bacaklıdır?,"['A) Fındık', 'B) Fıstık', 'C) Çekirdek', 'D) Karides']",D,D,Bilim,2,0.0,yok,True,False
rjQEjFrLZVU,Contestant_328,Hangisinde ünlü düşmesi vardır?,"['A) Kulağı', 'B) Burnu', 'C) Boğazı', 'D) Dişi']",B,B,Edebiyat,3,0.0,yok,True,False
rjQEjFrLZVU,Contestant_328,Dinlediğiniz Yadigar adlı şarkıyı kim seslendirmektedir?,"['A) Serdar Ortaç', 'B) Mahsun Kırmızıgül', 'C) Soner Arıca', 'D) Ali Güven']",D,D,Müzik,4,0.0,yok,True,False
rjQEjFrLZVU,Contestant_328,Boşa kostaklanma Kostak değilsin diyen biri karşısındakine özetle hangisini söylüyor olur?,"['A) Gösteriş yapma zarif değilsin', 'B) Engellemeye çalışma yapamazsın', 'C) Saate bakma yetiştiremezsin', 'D) Ahtapot besleme doyuramazsın']",A,A,Genel Kültür,5,0.0,yok,True,False
rjQEjFrLZVU,Contestant_328,Urartuların başkenti Tuşba kalıntılarını gezen biri hangi ildedir?,"['A) Çorum', 'B) Manisa', 'C) Van', 'D) Şanlıurfa']",C,C,Tarih,6,0.0,seyirci,True,False
rjQEjFrLZVU,Contestant_328,"Ray Charles'ı canlandırdığı Ray filmiyle 2005'te En İyi Erkek Oyuncu Oscar'ını kazanan, Quentin Tarantino'nun yönettiği Zincirsiz filmindeki Django karakteriyle de bilinen oyuncu kimdir?","['A) Jamie Foxx', 'B) Christoph Waltz', 'C) Laurence Fishburne', 'D) Ray Bradbury']",A,A,Sanat,7,0.0,telefon,True,False
rjQEjFrLZVU,Contestant_328,1799'da Napolyon'un Mısır işgali sırasında tesadüfen bulunan ve eski Mısır hiyerogliflerini çözülmesini sağlayan Rosetta Taşı günümüzde hangi bir müzede sergilenmektedir?,"['A) Mısır', 'B) Fransa', 'C) İngiltere', 'D) Türkiye']",C,D,Tarih,8,0.0,yarı_yarıya,True,False
rjQEjFrLZVU,Contestant_328,Dünya tarihi boyunca yaşamış canlı türlerinden yaklaşık yüzde kaçının soyu tamamen tükenmiştir?,"['A) 24', 'B) 49', 'C) 74', 'D) 99']",D,C,Bilim,9,0.0,yok,False,True
rjQEjFrLZVU,Contestant_329,Hangisi hava taşıtından veya yüksek bir yerden atılan bir cismin veya atlayan bir insanın kontrollü biçimde yere inmesini sağlayan araçtır?,"['A) Palet', 'B) Kaykay', 'C) Paraşüt', 'D) Uçurtma']",C,C,Genel Kültür,1,0.0,yok,True,False
rjQEjFrLZVU,Contestant_329,Kaşlara ve gözlere makyaj yapmak dudak kenarlarını çizmek için kullanılan boyama aracı hangisinin tanımlarından biridir?,"['A) Kürdan', 'B) Divit', 'C) Tebeşir', 'D) Kalem']",D,D,Genel Kültür,2,0.0,yok,True,False
rjQEjFrLZVU,Contestant_329,Karşısındakini yanıltarak aldatıcı tavır takınan biri ne yapmış olur?,"['A) Biz', 'B) GF', 'C) Blöf', 'D) Düet']",C,C,Genel Kültür,3,0.0,yok,True,False
rjQEjFrLZVU,Contestant_329,Hangisi paçası bileğin biraz üstü arasında olan bir pantolon çeşididir?,"['A) Capri', 'B) Postiş', 'C) Bluz', 'D) Makosen']",A,A,Genel Kültür,4,0.0,yok,True,False
rjQEjFrLZVU,Contestant_329,Dinlediğiniz mektubumu Buldun mu adlı şarkıyı kim seslendirmektedir?,"['A) Emel Sayın', 'B) Zerrin Özer', 'C) Gönül Yazar', 'D) Reyhan Karaca']",C,C,Müzik,5,0.0,telefon,True,False
rjQEjFrLZVU,Contestant_329,Türkiye'den Kapıkule Sınır Kapısı üzerinden çıkarsanız hangi ülkeye girmiş olursunuz?,"['A) Yunanistan', 'B) Bulgaristan', 'C) Gürcistan', 'D) Ermenistan']",B,A,Coğrafya,6,0.0,yok,False,True
rjQEjFrLZVU,Contestant_330,Hangisi genellikle boyuna takılan bir takıdır?,"['A) Yüzük', 'B) Küpe', 'C) Hal Hal', 'D) Gerdanlık']",D,D,Genel Kültür,1,0.0,yok,True,False
rjQEjFrLZVU,Contestant_330,Bu durumdan ötürü çok bahtiyarım diyen biri hangi duyguyu yaşıyordur?,"['A) Şaşkınlık', 'B) Mutluluk', 'C) Pişmanlık', 'D) Kızgınlık']",B,C,Genel Kültür,2,0.0,yok,False,True
rjQEjFrLZVU,Contestant_331,Genellikle giysilerin buruşukluklarını gidermek için üzerinden geçirilen kızgın demir araç hangisi olur?,"['A) Blender', 'B) Air fryer', 'C) Ütü', 'D) Rondo']",C,C,Genel Kültür,1,0.0,yok,True,False
rjQEjFrLZVU,Contestant_331,Önce bindallı bir iki gün sonra ise gelinlik giyecek olan biri muhtemelen hangisi için hazırlanıyordur?,"['A) Düğün', 'B) Mezuniyet', 'C) Öğrencilik', 'D) Emeklilik']",A,A,Genel Kültür,2,0.0,yok,True,False
rjQEjFrLZVU,Contestant_331,Dereden büyük ırmaktan küçük akarsuya verilen ad nedir?,"['A) Şıra', 'B) Çay', 'C) Boza', 'D) Süt']",B,B,Coğrafya,3,0.0,seyirci,True,False
rjQEjFrLZVU,Contestant_331,Görmüş geçirmiş deneyimi fazla olanlar için kulağı nasıl denir?,"['A) Bölük', 'B) Pörçük', 'C) Kesik', 'D) Yanık']",C,C,Genel Kültür,4,0.0,yok,True,False
rjQEjFrLZVU,Contestant_331,Tavla oynarken atılan zar düşeş geldiyse zarların üstte gelen benekleri hangisini gösterir?,"['A) 2-1', 'B) 5-4', 'C) 6-2', 'D) 6-6']",D,D,Genel Kültür,5,0.0,yok,True,False
rjQEjFrLZVU,Contestant_331,Dinlediğiniz Seninle Başım Dertte adlı şarkıyı kim seslendirmektedir?,"['A) İbrahim Tatlıses', 'B) Selami Şahin', 'C) Barış Manço', 'D) Ferdi Özbeğen']",B,B,Müzik,6,0.0,yarı_yarıya,True,False
rjQEjFrLZVU,Contestant_331,Yaprak Dökümü ve Çalıkuşu hangi yazarın romanıdır?,"['A) Reşat Nuri Güntekin', 'B) Ömer Seyfettin', 'C) Mehmet Rauf', 'D) Halit Ziya Uşaklıgil']",A,D,Edebiyat,7,0.0,telefon,False,True
rjQEjFrLZVU,Contestant_332,Makyaj yaparken kullanılan malzemeler arasında genellikle hangisi olmaz?,"['A) Göz kalemi', 'B) Kaş kalemi', 'C) Dudak kalemi', 'D) Kontrol kalemi']",D,D,Genel Kültür,1,0.0,yok,True,False
rjQEjFrLZVU,Contestant_332,İnsanlardaki hastalıkları teşhis ve onları ilaçlarla veya bazı araçlarla tedavi edenler kimlerdir?,"['A) Hekimler', 'B) Kırtasiyeciler', 'C) Yaşam koçları', 'D) Emlakçılar']",A,A,Genel Kültür,2,0.0,yok,True,False
rjQEjFrLZVU,Contestant_332,İyi bir barista hangilerinin yapımında ustalaşmış olur?,"['A) Ali Nazik, Şakşuka, Babagannuş', 'B) Flat White, Ristretto, Macchiato', 'C) Trileçe, Profiterol, Tiramisu', 'D) Kelle paça, İşkembe, Dürüm']",B,B,Genel Kültür,3,0.0,yok,True,False
rjQEjFrLZVU,Contestant_332,Dinlediğiniz Blinding Lights adlı şarkıyı kim seslendirmektedir?,"['A) Frank Sinatra', 'B) John Lennon', 'C) The Weeknd', 'D) Justin Bieber']",C,C,Müzik,4,0.0,yok,True,False
rjQEjFrLZVU,Contestant_332,43. bölümde vuruldu 45. bölümde öldü diyen bir Kurtlar Vadisi hayranının bahsettiği karakter hangisidir?,"['A) Polat Alemdar', 'B) Süleyman Çakır', 'C) Memati Baş', 'D) Abuzer Kömürcü']",B,B,Genel Kültür,5,0.0,yok,True,False
rjQEjFrLZVU,Contestant_332,Pazar adlı ilçeden Pazar adlı bir başka ilçeye giden biri hangi iki il arasında seyahat etmiş olur?,"['A) Rize ile Tokat', 'B) Edirne ile Kocaeli', 'C) Antalya ile Adana', 'D) Malatya ile Batman']",A,A,Coğrafya,6,0.0,seyirci,True,False
rjQEjFrLZVU,Contestant_332,Masal derleyicisi ünlü Grimm kardeşlerin adları nedir?,"['A) Sonny ve Fredo', 'B) Orville ve Wilbur', 'C) Hansel ve Gretel', 'D) Jacob ve Wilhelm']",D,D,Edebiyat,7,0.0,telefon,True,False
rjQEjFrLZVU,Contestant_332,İngiltere Kralı VIII. Henry'nin İngiltere kanunlarına göre resmi olarak evlendiği toplam kaç eşi olmuştur?,"['A) 2', 'B) 4', 'C) 6', 'D) 8']",C,C,Tarih,8,0.0,yarı_yarıya,True,False
rjQEjFrLZVU,Contestant_332,"Şu anda yarıştığınız Kim Milyoner Olmak İster'deki hiçbir sorunun cevabını bilmeden, hiçbir joker kullanmadan tüm soruları atıp tutturarak 5 milyon liralık ödülü kazanma ihtimali nedir?","[""A) 16.384'te bir ihtimal"", ""B) 262.144'te bir ihtimal"", ""C) 4.194.304'te bir ihtimal"", ""D) 67.108.864'te bir ihtimal""]",D,D,Matematik,9,0.0,yok,True,False
rjQEjFrLZVU,Contestant_332,Hangi oyuncu kariyerinde daha az Oscar Ödülü kazanmıştır?,"['A) Robert De Niro', 'B) Al Pacino', 'C) Marlon Brando', 'D) Anthony Hopkins']",B,,Sanat,10,0.0,yok,False,True
rjQEjFrLZVU,Contestant_333,Hangisi tezli lisansüstü eğitim programlarının bir çoğunda başvuracak adaylardan istenenler olur?,"['A) Maaş bordrosu', 'B) Banka hesap dökümü', 'C) Kira kontratı örneği', 'D) ALES sonuç belgesi']",D,D,Genel Kültür,1,0.0,yok,True,False
rjQEjFrLZVU,Contestant_333,Tüm Salonu kırdı geçirdi Bazı yerlerde gülmekten gözümden yaş geldi diyen birinin performansını yorumladığı Muhtemelen kimdir?,"['A) Tenör', 'B) Komedyen', 'C) Sınav gözetmeni', 'D) Orkestra şefi']",B,B,Genel Kültür,2,0.0,yok,True,False
rjQEjFrLZVU,Contestant_333,Üzengi hangisine binildiğinde ayakların basılmasına yarayan altı düz Demir halkadır?,"['A) Asansör', 'B) Yürüyen merdiven', 'C) Uçak', 'D) At']",D,D,Genel Kültür,3,0.0,yok,True,False
rjQEjFrLZVU,Contestant_333,Dizenin eş anlamlısı hangisidir?,"['A) Mısra', 'B) Dörtlük', 'C) Uyak', 'D) Redif']",A,A,Edebiyat,4,0.0,yok,True,False
rjQEjFrLZVU,Contestant_333,Ünlü çizgi film karakteri Düldül için hangi bilgi doğrudur?,"[""A) Gargamel'in kedisidir"", ""B) Fred Çakmaktaş'ın dinozorudur"", ""C) Red Kit'in atıdır"", ""D) Charlie Brown'un köpeğidir""]",C,C,Genel Kültür,5,0.0,seyirci,True,False
rjQEjFrLZVU,Contestant_333,Dinlediğiniz Ateşle Barut adlı şarkıyı kim seslendirmektedir?,"['A) Aşkın Nur Yengi', 'B) Sertab Erener', 'C) Yıldız Tilbe', 'D) İbrahim Tatlıses']",B,B,Müzik,6,0.0,telefon,True,False
rjQEjFrLZVU,Contestant_333,Hangisini ziyaret ediyorsanız Peru'dasınızdır?,"[""A) İnka'ların başkenti Cusco"", ""B) Aztek'lerin başkenti Tenochtitlan"", ""C) Sümer'lerin başkenti Ur"", ""D) Pers'lerin başkenti Persepolis""]",A,,Tarih,7,0.0,yarı_yarıya,False,True
rjQEjFrLZVU,Contestant_334,Hangisi genellikle tarlada kullanılır?,"['A) Formula 1 aracı', 'B) Jetski', 'C) Biçerdöver', 'D) Transatlantik']",C,C,Genel Kültür,1,0.0,yok,True,False
rjQEjFrLZVU,Contestant_334,Yemek tariflerinde gerekli malzemelerin ölçüleri ile birlikte listelendiği hangi katta bir Başlığa genellikle rastlanmaz?,"['A) Sosu için', 'B) Terbiyesi için', 'C) İç harcı için', 'D) Yalıtım kaplaması için']",D,D,Genel Kültür,2,0.0,yok,True,False
rjQEjFrLZVU,Contestant_334,Deniz analarının genellikle nesi olur?,"['A) Toynakları', 'B) Hörgüçleri', 'C) Pençeleri', 'D) Dokunaçları']",D,D,Bilim,3,0.0,yok,True,False
rjQEjFrLZVU,Contestant_334,Çaydan küçük yazın kuruyan veya suyu azalan küçük akarsu hangisidir?,"['A) Dere', 'B) Nehir', 'C) Göl', 'D) Irmak']",A,A,Coğrafya,4,0.0,yarı_yarıya,True,False
rjQEjFrLZVU,Contestant_334,Dinlediğiniz Kumralım adlı şarkının sözlerinde geçen sorulardan biri değildir?,"['A) Aylardan hangi aydır?', 'B) Gözlerim ne renkti?', 'C) Benim adım neydi?', 'D) Bugün günlerden neydi?']",D,D,Müzik,5,0.0,yok,True,False
rjQEjFrLZVU,Contestant_334,Hangi ünlü kurgusal karakter kenarı ve püskülü sarı renkli olan turkuaz bir bere takar?,"['A) Eric Cartman', 'B) BoJack Horseman', 'C) Rick', 'D) Tsubasa Ozora']",A,C,Genel Kültür,6,0.0,seyirci,False,True
rjQEjFrLZVU,Contestant_335,Üzerine tahin dökülerek de servis edilen genellikle hangisi olur?,"['A) Kokoreç', 'B) Suşi', 'C) İskender kebap', 'D) Kabak tatlısı']",D,D,Genel Kültür,1,0.0,yok,True,False
rjQEjFrLZVU,Contestant_335,Filmlerdeki klişe takip sahnelerinde fazla uzağa gitmiş olamazlar diyen karakterin öncesinde söylediği genellikle hangisi olur?,"['A) Çimenler hala yeşil', 'B) Hava hala azotlu', 'C) Küller hala sıcak', 'D) Dünya hala geoit']",C,C,Genel Kültür,2,0.0,seyirci,True,False
rjQEjFrLZVU,Contestant_335,Sıra sıra odalar birbirini kovalar şeklinde sorulan bilmecenin cevabı için söylenen genellikle hangisi olur?,"['A) Denizaltı', 'B) Tren', 'C) Helikopter', 'D) Zeplin']",B,B,Genel Kültür,3,0.0,yok,True,False
rjQEjFrLZVU,Contestant_335,Pusulalarda 4 ana yönü göstermek için kullanılan harfler hangileridir?,"['A) N, S, W, E', 'B) O, P, E, C', 'C) C, F, I, B', 'D) K, M, O, I']",A,A,Coğrafya,4,0.0,yok,True,False
rjQEjFrLZVU,Contestant_335,Dinlediğiniz Karahisar Kalesi adlı türküyü kim seslendirmektedir?,"['A) Murat Kekilli', 'B) Kıraç', 'C) Nev', 'D) Kubat']",B,B,Müzik,5,0.0,yok,True,False
rjQEjFrLZVU,Contestant_335,Hangi ünlü yapıyı görmek isteyen birinin gitmesi gereken ülke İngiltere'dir?,"['A) Tac Mahal', 'B) Angkor Wat', 'C) Pisa Kulesi', 'D) Stonehenge']",D,D,Genel Kültür,6,0.0,telefon,True,False
rjQEjFrLZVU,Contestant_335,Hangisi Cemal Süreya'nın değil Edip Cansever'in bir şiirinin adıdır?,"['A) Üvercinka', 'B) Mendilimde Kan Sesleri', 'C) Yazmam Daha Aşk Şiiri', 'D) Üstü Kalsın']",B,B,Edebiyat,7,0.0,yok,True,False
rjQEjFrLZVU,Contestant_335,Hangisi Periyodik tabloda yer alan bir elementin kısaltması değildir?,"['A) He', 'B) La', 'C) Ya', 'D) Na']",C,C,Bilim,8,0.0,yarı_yarıya,True,False
rjQEjFrLZVU,Contestant_335,Padişahken yurt dışı ziyaretlerinde bulunan ilk ve tek Osmanlı padişahı kimdir?,"['A) Abdülmecid', 'B) III. Selim', 'C) Abdülaziz', 'D) II. Abdülhamid']",C,A,Tarih,9,0.0,yok,False,True
S5ZEqcFVZg4,Contestant_336,Kulağın sesi toplayarak orta kulağa göndermeye yarayan yarım daire biçimindeki bölümü kulağın nesidir?,"['A. Havanı', 'B. Cezvesi', 'C. Kazanı', 'D. Kepçesi']",D,D,Bilim,1,2000.0,yok,True,False
S5ZEqcFVZg4,Contestant_336,"Bal köpüğü, cam göbeği, deve tüyü, gül kurusu, nar çiçeği, ördek gagası, tavşan kanı, turna gözü, vapur dumanı, vişne çürüğü ve yavru ağzı hangisine verilen adlardır?","['A. Müzik notaları', 'B. Kimyasal elementler', 'C. Renkler', 'D. Geometrik şekiller']",C,C,Genel Kültür,2,5000.0,yok,True,False
S5ZEqcFVZg4,Contestant_336,Büyükanne kılığına giren kurdun da yer aldığı ünlü masalın baş kahramanı nasıl tarif edilir?,"['A. Kırmızı başlıklı', 'B. Sarı çizmeli', 'C. Güneş gözlüklü', 'D. Kürk mantolu']",A,A,Edebiyat,3,7500.0,yok,True,False
S5ZEqcFVZg4,Contestant_336,Tayın babasına ne denir?,"['A. Aygır', 'B. Camız', 'C. Teke', 'D. Boa']",A,A,Genel Kültür,4,10000.0,yok,True,False
S5ZEqcFVZg4,Contestant_336,Dinlediğiniz konuşmada bahsedilen futbolcu kimdir?,"['A) Messi', 'B) Maradona', 'C) Zidan', 'D) Pele']",D,D,Spor,5,20000.0,yok,True,False
S5ZEqcFVZg4,Contestant_336,"Leyla Ela gözlü bir çöl ahusu. Saçları bahtından daha siyahtır. Kurumuş diye sevda yolunda pusu, döktüğü gözyaşı, çektiği ahtır. Dizelerinin şairi kimdir?","['A) Tevfik Fikret', 'B) Ahmet Hamdi Tanpınar', 'C) Orhan Veli Kanık', 'D) Recaizade Mahmut Ekrem']",B,B,Edebiyat,6,30000.0,"seyirci, yarı_yarıya",True,False
S5ZEqcFVZg4,Contestant_336,Hangisi Güney Amerika seyahatine çıkan birinin görebileceği yerlerden biri değildir?,"['A) Patagonya bölgesi', 'B) Parana Nehri', 'C) Niagara Şelalesi', 'D) Pampa Ovası']",C,C,Coğrafya,7,50000.0,telefon,True,False
S5ZEqcFVZg4,Contestant_336,"Bir insanın hangi hayvanın karaciğerinden tek bir ısırık alması, hastaneye kaldırılmasına, karaciğerinin tümü yemesi ölümüne yol açabilir?","['A) Su aygırı', 'B) Kanguru', 'C) Kaplan', 'D) Kutup ayısı']",D,D,Bilim,8,100000.0,çift_cevap,True,False
S5ZEqcFVZg4,Contestant_336,Yaşlılık dönemi hangisinin tanımlarından biridir?,"['A. İlkbahar', 'B. Yaz', 'C. Sonbahar', 'D. Kış']",C,C,Genel Kültür,9,200000.0,yok,True,False
S5ZEqcFVZg4,Contestant_336,Türkan Şoray'ın beyaz perdede başrolleri en çok paylaştığı erkek oyuncu kimdir?,"['A) Ediz Hun', 'B) İzzet Günay', 'C) Kadir İnanır', 'D) Cüneyt Arkın']",,,Sanat,10,300000.0,yok,False,True
S5ZEqcFVZg4,Contestant_337,Özellikle kış aylarında anne ve babalar banyo yaptıktan sonra dışarı çıkmak isteyen çocuklarını ne diyerek uyarırlar?,"['A) Arkandan ağlar', 'B) Anne olunca anlarsın', 'C) Baba olunca anlarsın', 'D) Hasta olursun']",D,D,Genel Kültür,1,2000.0,yok,True,False
S5ZEqcFVZg4,Contestant_337,Yoldan gelir gelmez henüz dinlenmeden anlamındaki deyimde hangisinin tozuyla denir?,"['A. Alnının', 'B. Dişinin', 'C. Ayağının', 'D) Kaşının']",C,C,Genel Kültür,2,5000.0,yok,True,False
S5ZEqcFVZg4,Contestant_337,"Dersi anlattığı esnada sinüs, kosinüs, tanjant ve kotanjant terimlerini sıkça kullanan biri muhtemelen hangi dersin öğretmenidir?","['A) Matematik', 'B) Beden eğitimi', 'C) Biyoloji', 'D) Müzik']",A,A,Matematik,3,7500.0,yok,True,False
S5ZEqcFVZg4,Contestant_337,Dinlediğiniz Sevdanın Rengi adlı şarkıyı seslendiren kimdir?,"['A) Mahsun Kırmızı Gül', 'B) İbrahim Tatlıses', 'C) İzzet Yıldızhan', 'D) Özcan Deniz']",D,D,Müzik,4,10000.0,yarı_yarıya,True,False
S5ZEqcFVZg4,Contestant_337,Erkek seslerinin en kalından en tiz olanına doğru sıralanışı hangisidir?,"['A) Bas tenor bariton', 'B) Bas bariton tenor', 'C) Tenor bas bariton', 'D) Tenor bariton bas']",B,B,Müzik,5,20000.0,seyirci,True,False
S5ZEqcFVZg4,Contestant_337,"Takoz Recep, Atom Karınca Rıza ve Şifo Mehmet olarak bilinen futbolcular 1980'ler ve 1990'larda hangi takımda beraber oynamıştır?","['A. Fenerbahçe', 'B. Beşiktaş', 'C. Gençlerbirliği', 'D. Galatasaray']",B,B,Spor,6,30000.0,yok,True,False
S5ZEqcFVZg4,Contestant_337,Hangi ünlü romanda George Milton ve Lenny Small adlı iki çiftçinin hikayesi anlatılır?,"['A) Suç ve Ceza', 'B) Kızıl ile Kara', 'C) Fareler ve İnsanlar', 'D) Mai ve Siyah']",C,C,Edebiyat,7,50000.0,telefon,True,False
S5ZEqcFVZg4,Contestant_337,Hangisi sınırlarından Ekvator çizgisinin geçtiği varsayılan ülkelerden biri değildir?,"['A) Ekvator Ginesi', 'B) Somali', 'C) Ekvator', 'D) Maldivler']",A,A,Coğrafya,8,100000.0,çift_cevap,True,False
S5ZEqcFVZg4,Contestant_337,Hangi ülkenin nüfusu İstanbul'un nüfusundan daha azdır?,"['A. Hollanda', 'B. Tunus', 'C. Şili', 'D. Avustralya']",,,Coğrafya,9,200000.0,yok,False,True
S5ZEqcFVZg4,Contestant_338,Bozulmadan uzun süre saklamak için diprizde muhafaza edilenler genellikle hangisi olur?,"['A) Hatıra defterleri', 'B) Lise yıllıkları', 'C. Nostaljik fotoğraflar', 'D. Besinler']",D,D,Genel Kültür,1,2000.0,yok,True,False
S5ZEqcFVZg4,Contestant_338,Gün gibi açık hangi anlama gelen bir deyimdir?,"['A. Çok belli', 'B. Alakasız', 'C. Çok karışık', 'D. Belirsiz']",A,A,Edebiyat,2,5000.0,yok,True,False
S5ZEqcFVZg4,Contestant_338,Sınava girmeden önce adaylara yumuşak uçlusunu kullanmaları tavsiye edilen genellikle hangisi olur?,"['A) Cetvel', 'B) Pergel', 'C) Kalem', 'D) Gönye']",C,C,Genel Kültür,3,7500.0,yok,True,False
S5ZEqcFVZg4,Contestant_338,Hangisi spor salonlarında bulunan bir aletin adıdır?,"['A) Rekreasyon tramvayı', 'B) Difüzyon feribotu', 'C) Renovasyon tırı', 'D) Kondisyon bisikleti']",D,D,Spor,4,10000.0,yok,True,False
S5ZEqcFVZg4,Contestant_338,Söz ve müziği Orhan Gencebay'a ait olan Dinlediğiniz Dokunma adlı şarkıyı seslendiren grup hangisidir?,"['A) 84', 'B) Manga', 'C) Ersen ve Dadaşlar', 'D) Grup Vitamin']",A,A,Müzik,5,20000.0,yok,True,False
S5ZEqcFVZg4,Contestant_338,Formen ne demektir?,"['A) Yüzbaşı', 'B) Koçbaşı', 'C) Ustabaşı', 'D) Bezirganbaşı']",C,C,Genel Kültür,6,30000.0,seyirci,True,False
S5ZEqcFVZg4,Contestant_338,Yönetmenliğini Stanley Kubrick'in yaptığı 1987 yapımı Full Metal Jacket adlı film hangi savaşı konu alır?,"['A. Vietnam Savaşı', 'B. Dünya Savaşı', 'C. İspanya İç Savaşı', 'D) Güller Savaşı']",A,A,Sanat,7,50000.0,telefon,True,False
S5ZEqcFVZg4,Contestant_338,"Kuzey, güney, doğu, batı. Dört yarımkürede de toprağı olan kıta hangisidir?","['A. Avustralya', 'B. Avrupa', 'C. Güney Amerika', 'D. Afrika']",D,D,Coğrafya,8,100000.0,yok,True,False
S5ZEqcFVZg4,Contestant_338,Futbolda kalecinin eliyle fırlattığı top doğrudan rakip takımın kalesine girerse kurallara göre hangisi olur?,"['A. Kale vuruşu', 'B. Gol', 'C. Ofsayt', 'D. Direkt serbest vuruş']",A,A,Spor,9,200000.0,yarı_yarıya,True,False
S5ZEqcFVZg4,Contestant_338,Hangisinin yaklaşık 34.000 farklı türü vardır ve bu sayı diğer üçünün toplamından daha fazladır?,"['A. Kuş', 'B. Amfibi', 'C. Balık', 'D. Sürüngen']",C,C,Bilim,10,300000.0,çift_cevap,True,False
S5ZEqcFVZg4,Contestant_338,17. yüzyılın sonunda Panama'yı sömürgeleştirmeye çalışıp başarısız olan ve bu süreçte yıllık gelirinin yaklaşık yarısını kaybederek finansal olarak iflas eden hangisidir?,"['A. Hollanda', 'B. Fransa', 'C. Meksika', 'D. İskoçya']",D,,Tarih,11,500000.0,yok,False,True
S5ZEqcFVZg4,Contestant_339,Birbirlerine selektör yapanlar genellikle kimler olur?,"['A) Kasa kuyruğundaki müşteriler', 'B) Futbol maçındaki hakemler', 'C) Trafikteki sürücüler', 'D) Sınavdaki öğrenciler']",C,C,Genel Kültür,1,2000.0,yok,True,False
S5ZEqcFVZg4,Contestant_339,1980'lerde ve 1990'larda gençler arasında kullanılan ve elbette tabii ki anlamına gelen ifade hangisi olurdu?,"['A) Daha neler?', 'B) Yok artık', 'C) Ne alaka', 'D) Herhalde yani']",D,D,Genel Kültür,2,5000.0,seyirci,True,False
S5ZEqcFVZg4,Contestant_339,Notaları öğreten Do bir külah dondurma diye başlayan çocuk şarkısında mi'den hemen sonra gelen hangisidir?,"['A) Masmavi bir dere', 'B) Derede bir gemi', 'C) Gemide bir tayfa', 'D) Papatyalı bir yol']",C,A,Müzik,3,7500.0,telefon,False,True
S5ZEqcFVZg4,Contestant_340,Kimler kimlerin odalarında telsiz ve kamera gibi cihazlar bulundurarak onları kontrol etmek amacıyla takip ederler?,"['A. Popçular hayranlarının', 'B. Influencerlar takipçilerinin', 'C. Futbolcular taraftarların', 'D. Ebeveynler bebeklerinin']",D,D,Genel Kültür,1,2000.0,yok,True,False
S5ZEqcFVZg4,Contestant_340,Hangisi? Çok iri cüsseli kişiler için yapılan bir benzetmedir.,"['A) Sakız gibi', 'B) Izbandut gibi', 'C) Pamuk gibi', 'D) Kuzu gibi']",B,B,Genel Kültür,2,5000.0,yok,True,False
S5ZEqcFVZg4,Contestant_340,Plonjon yapmak futbolda hangi mevkideki oyuncunun rakipten gelen şutu uçarak gösterişli bir biçimde yakalamasına verilen addır?,"['A) Kaleci', 'B) Santrafor', 'C) Stoper', 'D) Sağ açık']",A,A,Spor,3,7500.0,yok,True,False
S5ZEqcFVZg4,Contestant_340,Gezme Ceylan bu dağlarda seni avlar şeklinde sözleri olan türkünün adı nedir?,"[""A) Antep'in hamamları"", ""B) Silifke'nin yoğurdu"", ""C) Urfa'nın etrafı"", ""D) Bursa'nın ufak tefek taşları""]",C,C,Müzik,4,10000.0,yok,True,False
S5ZEqcFVZg4,Contestant_340,Beyaz perdede Frodo Baggins'i canlandıran oyuncu kimdir?,"['A. Daniel Radcliffe', 'B. Elijah Wood', 'C. Brad Pitt', 'D. Johnny Depp']",B,B,Sanat,5,20000.0,seyirci,True,False
S5ZEqcFVZg4,Contestant_340,Hangisi diğer üçünden farklı bir uzunluktur?,"['A) 1 desimetre', 'B) 10 hektometre', 'C) 100 dekametre', 'D) 1000 metre']",A,D,Bilim,6,30000.0,yok,False,True
S5ZEqcFVZg4,Contestant_341,Daha çok eskiden genellikle kimler kimleri sözlüğe kaldırırdı?,"['A) Ev sahipleri kiracıları', 'B) Nikah memurları şahitleri', 'C) Öğretmenler öğrencileri', ""D) Stand-up'çılar seyircileri""]",C,C,Genel Kültür,1,2000.0,yok,True,False
S5ZEqcFVZg4,Contestant_341,Akla mantığa sığmıyor anlamına gelen ifade hangisidir?,"['A) Çok mantıklı', 'B) İnanılacak gibi değil', 'C) Akla uygun', 'D) Rasyonel']",B,B,Genel Kültür,2,5000.0,yok,True,False
S5ZEqcFVZg4,Contestant_341,Hangisi bir tür şekerdir?,"['A) Marangoz', 'B) Şaşkaloz', 'C) Salyangoz', 'D) Sakkaroz']",D,D,Bilim,3,7500.0,seyirci,True,False
S5ZEqcFVZg4,Contestant_341,Sölenterlerden olan bu deniz canlısı bir şemsiyeyi andıran gövdesiyle salınır gibi hareket ederek serbestçe yüzer cümlesinde bahsedilen hangisidir?,"['A. Denizanası', 'B. Su aygırı', 'C. Pirana', 'D. Katil balina']",A,A,Bilim,4,10000.0,yok,True,False
S5ZEqcFVZg4,Contestant_341,1000 sayısının 999 katı 999 sayısının 1000 katından kaç fazladır?,"['A) 999', 'B) 1000', 'C) 1999', 'D) 0']",D,D,Matematik,5,20000.0,yok,True,False
S5ZEqcFVZg4,Contestant_341,Dinlediğiniz Hazin Geliyor adlı şarkıyı seslendiren kimdir?,"['A. Selami Şahin', 'B. Hakan Taşıyan', 'C. Müslüm Gürses', 'D. Hakkı Bulut']",B,B,Müzik,6,30000.0,telefon,True,False
S5ZEqcFVZg4,Contestant_341,Hangisi Mozart'a ait ünlü bir eserin adı değildir?,"['A) Saraydan Kız Kaçırma', ""B) Figaro'nun Düğünü"", 'C) Kuğu Gölü Balesi', 'D) Don Giovanni']",C,B,Müzik,7,50000.0,yarı_yarıya,False,True
sEmG8FE_gZE,Contestant_342,Dalış yaparken palet genellikle nereye giyilir?,"['A) Boyna', 'B) Kulağa', 'C) Ele', 'D) Ayağı']",D,D,Genel Kültür,1,0.0,yok,True,False
