video_id,contestant,question,options,correct_answer,contestant_answer,category,level,amount,joker_used,is_correct,eliminated
Axr7VNSLkM4,Contestant_105,hakkında pire gibidir denilen biri Muhtemelen nasıldır?,"['çok tembeldir', 'çok ağırdır', 'çok hareketlidir', 'çok uyuşuktur']",C,C,Genel Kültür,1,0.0,yok,True,False
Axr7VNSLkM4,Contestant_105,hangisi boyunun iki yanında kolların gövdeye bağlandığı bölümdür?,"['omuz', 'dirsek', 'topuk', 'diz']",A,A,Genel Kültür,2,0.0,yok,True,False
Axr7VNSLkM4,Contestant_105,Bir yarışmada çeyrek finale kalan 8 takım veya yarışmacının dördünün elenmesiyle oluşan grup veya aşamaya ne ad verilir?,"['2. tur', 'çeyrek final', 'yarı final', 'final']",C,C,Spor,3,0.0,yok,True,False
Axr7VNSLkM4,Contestant_105,Hangisi bir armut çeşidine verilen addır?,"['satsuma', 'Deveci', 'Washington', 'mürdüm']",B,B,Genel Kültür,4,0.0,seyirci,True,False
Axr7VNSLkM4,Contestant_105,hangileri hamamda çalışan görevliler?,"['Seyis ve kabzımal', 'hallaç ve Nalbant', 'Çerçi ve hattat', 'külhancı ve tellak']",D,D,Genel Kültür,5,0.0,yok,True,False
Axr7VNSLkM4,Contestant_105,Dinlediğiniz 'Senden Vazgeçemem' adlı şarkıyı kim seslendirmektedir?,"['Semiramis Pekkan', 'Ümit Besen', 'Ferdi Özbeğen', 'Cengiz Kurtoğlu']",A,A,Müzik,6,0.0,telefon,True,False
Axr7VNSLkM4,Contestant_105,Herbert George adlı ünlü yazarın soyadı nedir?,"['Martin', 'Rowling', 'Wells', 'Tolkien']",C,A,Edebiyat,7,0.0,yarı_yarıya,False,True
b50eRWRrkF8,Contestant_106,nalburlarda genellikle hangisi satılmaz,"['A silikon tabancası', 'B su terazisi', 'C un kurabiyesi', 'D lokma takımı']",C,C,Genel Kültür,1,1000.0,yok,True,False
b50eRWRrkF8,Contestant_106,toy Acemi kişiler için hangisi söylenir,"['A eski çıkma', 'B önceki çekme', 'C Ezeli bitme', 'D yeni yetme']",D,D,Genel Kültür,2,5000.0,yok,True,False
b50eRWRrkF8,Contestant_106,hangisine haşerat denir,"['A Kuşlar', 'B balıklar', 'C böcekler', 'D yılanlar']",C,C,Bilim,3,7500.0,yok,True,False
b50eRWRrkF8,Contestant_106,koniva diyen biri hangi dilde ne demiş olur,"['A Almancada iyi akşamlar', 'B Japoncada Merhaba', 'C İspanyolcada Teşekkürler', 'D İngilizcede günaydın']",B,B,Genel Kültür,4,10000.0,yok,True,False
b50eRWRrkF8,Contestant_106,Dinlediğiniz Bir De Bana Sor adlı şarkıyı kim seslendirmektedir,"['A Erol Evgin', 'B Ferdi Özbeğen', 'C Cengiz Kurtoğlu', 'D Fedon']",A,A,Müzik,5,20000.0,seyirci,True,False
b50eRWRrkF8,Contestant_106,hangisi üzerine vişne benzeri şerbet dökülerek yenen rendelenmiş buzdur,"['A şöbiyet', 'B karsambaç', 'C peşmelba', 'D bülbül yuvası']",B,B,Genel Kültür,6,30000.0,yok,True,False
b50eRWRrkF8,Contestant_106,hangisi maim gorin romanlarından birinin adıdır,"['A ana', 'B Baba', 'C amca', 'D hala']",A,A,Edebiyat,7,50000.0,telefon,True,False
b50eRWRrkF8,Contestant_106,abam Sınıfı Uyanıyor adlı filmde geçen Teyzesi defterdar olan faytonla damda dolaşır ve kış geliyor ört hocam yorgan yorgan üstüne replikleri sırasıyla hangi karakterlere aittir,"['A Güdük Necmi ve Damat Ferit', 'B Damat Ferit ve dond al', 'C dond al ve tulum Hayri', 'D tulum ha ve Güdük Necmi']",A,B,Sanat,8,100000.0,yarı_yarıya,False,True
b50eRWRrkF8,Contestant_107,helikopter pisti olarak kullanılan düz bir alanın zeminine daire içinde alınmış şekilde genellikle hangi harf çizilmiş olur,"['A yumuşak g', 'B ş', 'C h', 'D ö']",C,C,Genel Kültür,1,1000.0,yok,True,False
b50eRWRrkF8,Contestant_107,Kontak lens hangisine takılarak kullanılır,"['A a dile', 'B burna', 'C göze', 'D dişe']",C,C,Genel Kültür,2,5000.0,yok,True,False
b50eRWRrkF8,Contestant_107,hangi kelimenin tersten yazılışı da Türkçe sözlükte yer alır,"['A cetvel', 'B kalem', 'C silgi', 'D kitap']",D,D,Edebiyat,3,7500.0,yok,True,False
b50eRWRrkF8,Contestant_107,İklim bilimcilere ne ad verilir,"['A hematolog', 'B farmakolog', 'C klimatolog', 'D jeomorfolog']",C,C,Bilim,4,10000.0,yok,True,False
b50eRWRrkF8,Contestant_107,Hangi klasik eserin yazarı jul wnir,"['A gülüverin Gezileri', 'B Denizler Altında 20.000 Fersah', 'C hakılberi film maceraları', 'D Yaşlı Adam ve Deniz']",B,B,Edebiyat,5,20000.0,telefon,True,False
b50eRWRrkF8,Contestant_107,Dinlediğiniz strong enough adlı şarkıyı kim seslendirmektedir,"['A sh', 'B Lana', 'C Britney Spears', 'D Dolly parton']",A,A,Müzik,6,30000.0,seyirci,True,False
b50eRWRrkF8,Contestant_107,canlanmış titikaka Gölü kurbağası doğal yaşam alanında ziyaret etmek için hangi kıtaya gitmeniz gerekir,"['A Asya', 'B Afrika', 'C Avustralya', 'D Güney Amerika']",D,D,Coğrafya,7,50000.0,yarı_yarıya,True,False
b50eRWRrkF8,Contestant_108,Ocak kelimesinin sözlük tanımında hangi ifade geçer,"['A yılın 1 ayı', 'B Yılın 2 ayı', 'C yılın 3 ayı', 'D yılın 4 ayı']",A,A,Genel Kültür,1,1000.0,yok,True,False
b50eRWRrkF8,Contestant_108,bil ilçede Devleti temsil eden en yetkili yönetim görevlisi kimdir,"['A Vali', 'B Kaymakam', 'C Muhtar', 'D noter']",B,B,Genel Kültür,2,5000.0,seyirci,True,False
b50eRWRrkF8,Contestant_108,Hangisi bir atasözü değildir,"['A Öfkeyle kalkan zararla oturur', 'B Lafla peynir gemisi yürümez', 'C Hamama giren terler', 'D Gülü seven düdüğü çalar']",D,D,Edebiyat,3,7500.0,telefon,True,False
b50eRWRrkF8,Contestant_108,küp kökü 3 olan sayı hangisidir,"['A 6', 'B 9', 'C 27', 'D 81']",C,C,Matematik,4,10000.0,yok,True,False
b50eRWRrkF8,Contestant_108,hangi iki ünlü animasyon film serisi karakteri aslandır,"['A piona ve Shrek', 'B mufasa ve Simba', 'C Sid ve meni', 'D Nemo ve dori']",B,B,Sanat,5,20000.0,yok,True,False
b50eRWRrkF8,Contestant_108,Dinlediğiniz Twist and shot adlı şarkıyı hangi grup seslendirmektedir,"['A the ic Brothers', 'B the brs', 'C the bres', 'D the coen Brothers']",A,A,Müzik,6,30000.0,yarı_yarıya,True,False
b50eRWRrkF8,Contestant_108,yerleşim yerleri arasında sayılan Hacılar Höyüğü hangi ilin sınırları içerisinde yer alır,"['A Gaziantep', 'B Burdur', 'C Şanlıurfa', 'D Çorum']",B,C,Tarih,7,50000.0,yok,False,True
b50eRWRrkF8,Contestant_109,evlenme Dolayısıyla yapılan törene ne ad verilir,"['A kamp', 'B piknik', 'C mezuniyet', 'D düğün']",D,D,Genel Kültür,1,1000.0,yok,True,False
b50eRWRrkF8,Contestant_109,Hangisi küçük deniz teknelerini yürütmeye yarayan bir ucu yastığı uzun ağaca verilen addır,"['A tabure', 'B kürek', 'C iskemle', 'D orak']",B,B,Genel Kültür,2,5000.0,yok,True,False
b50eRWRrkF8,Contestant_109,Medyada çok yer alan çok tanınan ve bilinen kişiler için kullanılan ifade hangisidir,"['A aromatik', 'B sentetik', 'C katalitik', 'D medyatik']",D,D,Genel Kültür,3,7500.0,yok,True,False
b50eRWRrkF8,Contestant_109,binek hayvanlarının kıllarını derisini temizleme anlamına gelen hangisidir,"['A tımar', 'B Rahvan', 'C Eğer', 'D tırı']",A,A,Genel Kültür,4,10000.0,yok,True,False
b50eRWRrkF8,Contestant_109,Dinlediğiniz Erkekler de Yanar adlı şarkı kime aittir,"['A nüfer', 'B Nazan Öncel', 'C Nüket Duru', 'D Reyhan Karaca']",A,A,Müzik,5,20000.0,seyirci,True,False
b50eRWRrkF8,Contestant_109,Hangi ünlü yapıyı görmek isteyen birinin gitmesi gereken ülke ingiltere'dir,"['A big ben Saat kulesi', 'B brandenburg kapısı', 'C Eyfel Kulesi', 'D Tac Mahal']",A,A,Coğrafya,6,30000.0,yarı_yarıya,True,False
b50eRWRrkF8,Contestant_109,Ne hasta bekler sabahı Ne taze ölüyü mezar Ne de şeytan bir günahı Seni beklediğim kadar dizeleriyle başlayan Necip Fazıl Kısakürek şiirinin adı nedir,"['A Kaldırımlar', 'B beklenen', 'C Canbaz', 'D Aynalar']",B,B,Edebiyat,7,50000.0,telefon,True,False
b50eRWRrkF8,Contestant_109,bir batıl inanca göre o yıl doğan kadınların Uğursuz kötü bir kişiliğe sahip olup ileride iyi bir eş olmayacağı düşünüldüğü için 1966'da yüz binlerce kadının doğum yapmaktan imtina ettiği ülke hangisidir,"['A Mısır', 'B Birleşik Krallık', 'C Japonya', 'D Meksika']",C,"['B', 'A']",Genel Kültür,8,100000.0,çift_cevap,False,True
b50eRWRrkF8,Contestant_110,ikili ilişkiler için kullanılan ve zıt kutuplar şeklinde başlayan sözün Devamı nasıldır,"['A birbirini uzaklaştırır', 'B birbirini uzaklaştırır birini', 'C birbirini düşürür', 'D birbirini çeker']",D,D,Genel Kültür,1,1000.0,yok,True,False
b50eRWRrkF8,Contestant_110,ağ ölen genellikle hangisi olur,"['A çiçek açacak', 'B Sinek kaçacak', 'C kelebek uçacak', 'D arı sokacak']",B,B,Genel Kültür,2,5000.0,yok,True,False
b50eRWRrkF8,Contestant_110,atasözüne göre akıldan Üstün olan hangisidir,"['A Sükut', 'B söz', 'C kalp', 'D akıl']",D,D,Edebiyat,3,7500.0,yok,True,False
b50eRWRrkF8,Contestant_110,Bir cismin hareket miktarı kütlenin surat ile çarpımı hangisinin sözlük tanımıdır,"['A korozyon', 'B eylemsizlik', 'C Momentum', 'D manyetizma']",C,C,Bilim,4,10000.0,yok,True,False
b50eRWRrkF8,Contestant_110,Niagara Şelalesi'ni görmek isteyen birinin gitmesi gereken ülke hangisidir,"['A Avustralya', 'B İspanya', 'C Kanada', 'D Hollanda']",C,A,Coğrafya,5,20000.0,seyirci,True,False
b50eRWRrkF8,Contestant_110,Dinlediğiniz bu yaz adlı şarkıyı kim seslendirmektedir,"['A Burcu Güneş', 'B Zerrin Özer', 'C Dem sağoğlu', 'D Reyhan Karaca']",B,B,Müzik,6,30000.0,telefon,True,False
b50eRWRrkF8,Contestant_110,Hangi klasik romanın Türkçe çevirisinin kapağı üzerinde İngilizce aslından çeviren şeklinde bir ifade yer alabilir,"['A iki şehrin hikayesi', 'B Sefiller', ""C notter Dam'ın Kamburu"", 'D Suç ve Ceza']",A,C,Edebiyat,7,50000.0,yarı_yarıya,False,True
b50eRWRrkF8,Contestant_111,sabah sabah ne demektir,"['A sabahın çok erken saati', 'B Öğlenin çok erken saatinde', 'C akşamın çok erken saatinde', 'D gecenin çok erken saatinde']",A,A,Genel Kültür,1,1000.0,yok,True,False
b50eRWRrkF8,Contestant_111,yemek pişirmeyi meslek edinmiştir,"['A nalburlar', 'B aşçılar', 'C Mimarlar', 'D Çiftçiler']",B,B,Genel Kültür,2,5000.0,yok,True,False
b50eRWRrkF8,Contestant_111,Hangisinin sözlük tanımında farklı insanlarla kolaylıkla iletişim kurabilme uyumlu çalışabilme insanları ikna edebilme yönetebilme becerilerini içeren zeka ifadesi geçer,"['A müziksel zeka', 'B matematiksel zeka', 'C sosyal zeka', 'D Yapay Zeka']",C,C,Genel Kültür,3,7500.0,yok,True,False
b50eRWRrkF8,Contestant_111,Türk alfabesinin son sesli harfi hangisidir,"['A ü', 'B ö', 'C y', 'D z']",A,A,Dil,4,10000.0,yok,True,False
b50eRWRrkF8,Contestant_111,Dinlediğiniz sesinde Aşk Var adlı şarkıyı kim seslendirmektedir,"['A Yaşar', 'B Yalın', 'C Ege', 'D Tarık Mengüç']",B,B,Müzik,5,20000.0,yok,True,False
b50eRWRrkF8,Contestant_111,4'ün küpü kaçtır,"['A 12', 'B 24', 'C 64', 'D 80']",C,C,Matematik,6,30000.0,yok,True,False
b50eRWRrkF8,Contestant_111,hangisi Yüzüklerin Efendisi kitap ve film serisinde geçen bir karakterdir,"['A gimli', 'B Yoda', 'C Hulk', 'D Hodor']",A,A,Sanat,7,50000.0,telefon,True,False
b50eRWRrkF8,Contestant_111,Türkçe resmi adında Konfederasyonu ifadesi geçen tek ülke hangisidir,"['A İsviçre', 'B Güney Kore', 'C Norveç', 'D Rusya']",A,D,Coğrafya,8,100000.0,seyirci,False,True
b50eRWRrkF8,Contestant_112,birine centilmence yaklaşan biri ona nasıl yaklaşmış olur,"['A saygılı Görgülü ve kibarca', 'B Kaba Saba ve beceriksizce', 'C egoist toy ve acemice', 'D bencil zevksiz ve nezaketsiz']",A,A,Genel Kültür,1,1000.0,yok,True,False
b50eRWRrkF8,Contestant_112,misafirinize şeker alır mısınız diye soruyorsanız ikram ettiğiniz içecek Muhtemelen hangisidir,"['A maden suyu', 'B boza', 'C şalgam suyu', 'D çay']",D,D,Genel Kültür,2,5000.0,yok,True,False
b50eRWRrkF8,Contestant_112,Hangisi bir atasözüdür,"['A Kaynayan Kazan küpüne zarar', 'B işleyen demir yaşken eğilir', 'C Kaçan balık aşık usandırır', 'D evdeki hesap Çarşıya uymaz']",D,D,Edebiyat,3,7500.0,yok,True,False
b50eRWRrkF8,Contestant_112,hangisinin finalinde karşılaşan iki tenisçinin maçını yerinde seyreden biri Londra'dan,"['A Wimbledon', 'B Avustralya açık', 'C Roland garos', 'D Amerika açık']",A,A,Spor,4,10000.0,yarı_yarıya,True,False
b50eRWRrkF8,Contestant_112,Hangisi bir istridye türünün adıdır,"['A Deniz makası', 'B Deniz tarağı', 'C Deniz cımbızı', 'D Deniz kaşığı']",B,B,Bilim,5,20000.0,yok,True,False
b50eRWRrkF8,Contestant_112,Yusuf atılgan'ın hangi hatta bir romanı vardır,"['A Aşkistan', 'B Gülistan', 'C canistan', 'D tornistan']",C,B,Edebiyat,6,30000.0,seyirci,False,True
b50eRWRrkF8,Contestant_113,sabah sabah ne demektir,"['A sabahın çok erken saati', 'B Öğlenin çok erken saatinde', 'C akşamın çok erken saatinde', 'D gecenin çok erken saatinde']",A,A,Genel Kültür,1,1000.0,yok,True,False
b50eRWRrkF8,Contestant_113,hangisi üflenerek çalınır,"['A darbuka', 'B kemen', 'C ne', 'D basgitar']",C,C,Müzik,2,5000.0,yok,True,False
b50eRWRrkF8,Contestant_113,insanoğlu insan anlamına gelen kelime hangisidir,"['A ikişer', 'B üçer', 'C dörder', 'D Beşer']",D,D,Dil,3,7500.0,yok,True,False
b50eRWRrkF8,Contestant_113,şu anda yarışmak olduğunuz programda size sorulan ilk üç sorunun doğru cevabı olan şıklar arasında hangisi yoktu,"['A a şıkkı', 'B b şıkkı', 'C c şıkkı', 'D d şıkkı']",B,B,Genel Kültür,4,10000.0,seyirci,True,False
b50eRWRrkF8,Contestant_113,Dünyanın bilinen en eski yerleşim yerleri arasında sayılan Çatal Höyük hangi ilin sınırları içerisinde yer alır,"['A Van', 'B Çorum', 'C Konya', 'D Şanlıurfa']",C,C,Tarih,5,20000.0,yarı_yarıya,True,False
b50eRWRrkF8,Contestant_113,Demiz rusos an orijinalini Dinlediğiniz şarkının acda Pekkan'ın seslendirdiği Türkçe versiyonunun adı nedir,"['A Eğlen Güzelim', 'B yaz yaz yaz', 'C Gözün aydın', 'D Kimler geldi kimler geçti']",C,C,Müzik,6,30000.0,telefon,True,False
b50eRWRrkF8,Contestant_113,Hangi ünlü edebiyatçı erkektir,"['A Agatha Christi', 'B irent', 'C JK rowling', 'D HP lovecraft']",D,D,Edebiyat,7,50000.0,yok,True,False
b50eRWRrkF8,Contestant_113,toplam yüz ölçümleri düşünüldüğünde Türkiye'nin içine en fazla kaç adet Konya ili sığar,"['A 9', 'B 19', 'C 29', 'D 39']",C,"['B', 'C']",Coğrafya,8,100000.0,çift_cevap,True,False
b50eRWRrkF8,Contestant_113,Türk Şoray hangi filmde Sabiha veya Güllü veya Türkan adlı bir karakteri canlandırmıştır,"['A vesikalı yarim', 'B Devlerin Aşkı', 'C Bodrum Hakimi', 'D Güllü']",A,,Sanat,9,200000.0,yok,False,False
C1idIOs806k,Contestant_114,Damağın arkasında bulunan dile benzer uzantıya ne ad verilir?,"['A) Sivri dil', 'B) Tatlı dil', 'C) yabancı dil', 'D) Küçük dil']",D,D,Genel Kültür,1,2000.0,yok,True,False
C1idIOs806k,Contestant_114,Genellikle mahalle maçlarında görülen ayağın ucuyla sertçe yapılan vuruşa ne ad verilir?,"['A) Lekeli göz', 'B) kirli kulak', 'C) pis burun', 'D) yağlı saç']",C,C,Spor,2,5000.0,yok,True,False
C1idIOs806k,Contestant_114,Biz kimseyi yarı yolda bırakmadık şeklinde başlayan kamyon arkası yazısının devamı genellikle nasıl olur?,"['A) Onlar abonmanlarını unuttular.', 'B) Onlar müsait bir yerde indiler.', 'C) Onlar otomatik kapıya çarptılar.', 'D) Onlar ters koltuğa oturdular.']",B,B,Genel Kültür,3,7500.0,yok,True,False
C1idIOs806k,Contestant_114,Döner bir makinenin çıkış kuvvetini ölçmekte kullanılan aygıta ne ad verilir?,"['A) dinamometre', 'B) termometre', 'C) barometre', 'D) kronometre']",A,A,Bilim,4,10000.0,yok,True,False
C1idIOs806k,Contestant_114,Sakarya Nehrinin hangi attadır?,"['A) Sansar çayı', 'B) Gelincik çayı', 'C) Kirpi çayı', 'D) Porsuk çayı']",D,D,Coğrafya,5,20000.0,yok,True,False
C1idIOs806k,Contestant_114,Dinlediğiniz Denizli'nin horozları adlı türküyü seslendiren kimdir?,"['A) Özdemir Erdoğan', 'B) İlhan Şeşen', 'C) Tanju Okan', 'D) Alpay']",A,A,Müzik,6,30000.0,yok,True,False
C1idIOs806k,Contestant_114,Türkçeye kızıl maske olarak çevrilmiş çizgi roman kahramanı Phantom'un gerçek adı nedir?,"['A) Bruce Wayne', 'B) Clark Kent', 'C) Kit Walker', 'D) Peter Parker']",C,C,Genel Kültür,7,50000.0,yarı_yarıya,True,False
C1idIOs806k,Contestant_114,At üstünde dört nala giderken ayaklarından sırığa bağlanmış canlı bir kazın kafasını tutup kopararak yapılan kaz çekme sporu hangi bölgede ortaya çıkmış ve 20. yüzyıla kadar yapılmıştır?,"['A) Batı Avrupa', 'B) Kuzeydoğu Afrika', 'C) Güneydoğu Asya', 'D) Güney Amerika']",A,A,Spor,8,100000.0,"telefon, çift_cevap",True,False
C1idIOs806k,Contestant_114,"Uzaydan dünyaya dönüşünde inmesi planlanan yerden yüzlerce kilometre uzaktaki bir patates tarlasına iniş yapan, o sırada patates ekmekte olan bir nine ve torunun uzaylı sandığı kişi kimdir?","['A) Neil Armstrong', 'B) Yuri Gagarin', 'C) Valentina Tereşkova', 'D) Buzz Aldrin']",B,B,Bilim,9,200000.0,yok,True,False
C1idIOs806k,Contestant_114,22 Mart 2022'de hangi spor kulübünün maçlarına ev sahipliği yapan stadyum en güçlü güneş enerjili stadyum unvanıyla Guinness Dünya Rekorları'na girmiştir?,"['A) Galatasaray', 'B) Fenerbahçe', 'C) Beşiktaş', 'D) Antalyaspor']",A,D,Spor,10,300000.0,yok,False,True
C1idIOs806k,Contestant_115,Genellikle hangisi kebap restoranlarında garsonların müşterilere servis yaparken yaptığı bir harekettir?,"['A) Salata tabağına IBAN yazmak', 'B) Yayık ayranının köpüğünü üflemek', 'C) Pilavın içine tek taş yüzük koymak', ""D) İskender'in üstüne tereyağı dökmek""]",D,D,Genel Kültür,1,2000.0,yok,True,False
C1idIOs806k,Contestant_115,Dünya atmosferinin dışında seyir halinde olan bir taşıt hangisi olabilir?,"['A) Tramvay', 'B) şehir hatları vapuru', 'C) uzay gemisi', 'D) metrobüs']",C,C,Bilim,2,5000.0,yok,True,False
C1idIOs806k,Contestant_115,Notaların yükseklik derecelerini göstermek ve buna göre okunmasını sağlamak için portenin başına konulan işarete verilen ad nedir?,"['A) cüzdan', 'B) anahtar', 'C) defter', 'D) çakmak']",B,B,Müzik,3,7500.0,yok,True,False
C1idIOs806k,Contestant_115,Hangisi daha büyüktür?,"['A) 0,01', 'B) 0,002', 'C) 0,008', 'D) 0,009']",A,A,Matematik,4,10000.0,yok,True,False
C1idIOs806k,Contestant_115,Kehribar gibi ne demektir?,"['A) sapsarı', 'B) Mas mavi', 'C) Yemyeşil', 'D) Kapkara']",A,A,Genel Kültür,5,20000.0,yok,True,False
C1idIOs806k,Contestant_115,"Necip Fazıl Kısakürek'in şiirinde, 'Çilekeş yalnızların annesi, içimde yaşamış bir insandır, içimde kıvrılan bir lisandır' diye tanımladığı hangisidir?","['A) Merdiven', 'B) Kaldırımlar', 'C) Han Duvarları', 'D) Sevgi Duvarı']",B,B,Edebiyat,6,30000.0,seyirci,True,False
C1idIOs806k,Contestant_115,Dinlediğiniz kayıtta söyledikleri tekrar edilen kişi kimdir?,"['A) Reha Muhtar', 'B) Mehmet Ali Birand', 'C) Erkan Yolaç', 'D) Saadettin Teksoy']",D,D,Genel Kültür,7,50000.0,"telefon, yarı_yarıya",True,False
C1idIOs806k,Contestant_115,Türkiye'de 2023'te trafik kazalarında vefat edenlerin cinsiyetlerine göre oranı nasıldır?,"['A) %45 erkek %55 kadın', 'B) %55 erkek %45 kadın', 'C) %65 erkek %35 kadın', 'D) %75 erkek %25 kadın']",D,C,Genel Kültür,8,100000.0,çift_cevap,False,True
C1idIOs806k,Contestant_116,"Laktozsuz kefir, diyet kola ve maden suyu marketlerin genellikle hangi reyonunda satılır?","['A) Meşrubat', 'B) unlu mamuller', 'C) Elektronik eşya', 'D) kuru yemiş ve bakliyat']",A,A,Genel Kültür,1,2000.0,yok,True,False
C1idIOs806k,Contestant_116,Hangisi internet siteleri ziyaret edilirken sıklıkla karşılaşılan bir uyarı bildiriminin başlığıdır?,"['A) Ketumluk ve garnitür politikası', 'B) Gizlilik ve çerez politikası', 'C) Mahremiyet ve cips politikası', 'D) Sükunet ve meşrubat politikası']",B,B,Teknoloji,2,5000.0,yok,True,False
C1idIOs806k,Contestant_116,Taç atışı genellikle hangisinde görülmez?,"['A) UEFA Şampiyonlar Ligi maçlarında', 'B) FIA Dünya Kupası maçlarında', 'C) UEFA Avrupa Ligi maçlarında', 'D) Halı Saha maçlarında']",D,D,Spor,3,7500.0,yok,True,False
C1idIOs806k,Contestant_116,Dinlediğiniz jenerik müziği hangi diziye aittir?,"['A) Ekmek Teknesi', 'B) İkinci Bahar', 'C) Çocuklar Duymasın', 'D) Süper Baba']",C,C,Müzik,4,10000.0,yok,True,False
C1idIOs806k,Contestant_116,Altın Portakal ödülleri sahiplerini buldu başlıklı bir haberde hangi şehirde düzenlenen bir film festivalinden bahsediliyordur?,"['A) İstanbul', 'B) İzmir', 'C) Antalya', 'D) Adana']",C,C,Sanat,5,20000.0,yok,True,False
C1idIOs806k,Contestant_116,Bir tarih kitabının 15. Yüzyılda Osmanlı Devleti adlı bölümünün alt başlıklarından biri hangisi olabilir?,"[""A) İstanbul'un fethi"", 'B) Köprülüler Devri', ""C) Bursa'nın fethi"", 'D) Tanzimat Devri']",A,A,Tarih,6,30000.0,yok,True,False
C1idIOs806k,Contestant_116,Hangi ünlü film serisi karakteri yılanlarla konuşabilen bir çatal ağızdır?,"['A) Jack Sparrow', 'B) Frodo Baggins', 'C) Harry Potter', 'D) Luke Skywalker']",C,C,Genel Kültür,7,50000.0,yok,True,False
C1idIOs806k,Contestant_116,Hangi iki ülke arasındaki sınır tam sınırdaki bir otelin odalarından birindeki yatağın ortasından geçmektedir?,"['A) Meksika - Kanada', 'B) Hindistan - İran', 'C) Fransa - İsviçre', 'D) Cezayir - Mısır']",C,C,Coğrafya,8,100000.0,yok,True,False
C1idIOs806k,Contestant_116,17 Ocak 1909'da Galatasaray ile Fenerbahçe arasında oynanan ilk maçın sonucu ne olmuştur?,"['A) 2-0 Galatasaray galibiyeti', 'B) 2-0 Fenerbahçe galibiyeti', 'C) 2-2 beraberlik', 'D) 3-2 Galatasaray galibiyeti']",B,B,Spor,9,200000.0,"telefon, yarı_yarıya, çift_cevap",True,False
C1idIOs806k,Contestant_116,Hangisi 1945'te ölmemiştir?,"['A) Benito Mussolini', 'B) Francisco Franco', 'C) Franklin Roosevelt', 'D) Adolf Hitler']",B,B,Tarih,10,300000.0,yok,True,False
C1idIOs806k,Contestant_116,2014'te 27 aylık bir bebek vücut sıcaklığı kaç santigrat dereceye düştükten sonra kurtarılmış ve bu olay Guinness Dünya Rekorları'na girmiştir?,"['A) 1,8', 'B) 11,8', 'C) 21,8', 'D) 31,8']",B,,Bilim,11,500000.0,seyirci,False,False
C1idIOs806k,Contestant_117,Hangisinin pedallı ön adıyla satılan pedalına basıldığında kapağı açılan çeşitleri vardır?,"['A) Tül', 'B) Masa örtüsü', 'C) Tüplü televizyon', 'D) Çöp kovası']",D,D,Genel Kültür,1,2000.0,yok,True,False
C1idIOs806k,Contestant_117,Tas tamam ne demektir?,"['A) Tıpa tıp', 'B) saçma', 'C) Alakasız', 'D) farklı']",A,A,Genel Kültür,2,5000.0,yok,True,False
C1idIOs806k,Contestant_117,Hangi şıkta bir element vardır?,"['A) Kankam', 'B) Kardom', 'C) Brom', 'D) Pam']",C,C,Bilim,3,7500.0,yok,True,False
C1idIOs806k,Contestant_117,Hangisi sığır değildir?,"['A) Öküz', 'B) İnek', 'C) Dana', 'D) Katır']",D,D,Genel Kültür,4,10000.0,yok,True,False
C1idIOs806k,Contestant_117,Otomatik vitesli otomobillerde ileri gitmek için vitesi hangi harfe getirmek gerekir?,"['A) D', 'B) N', 'C) P', 'D) R']",A,A,Genel Kültür,5,20000.0,yok,True,False
C1idIOs806k,Contestant_117,Hangisi bir bulut çeşidi değildir?,"['A) Stratus', 'B) Sirüs', 'C) Nimbus', 'D) Efesus']",D,D,Bilim,6,30000.0,seyirci,True,False
C1idIOs806k,Contestant_117,Müşfik Kenter'in canlandırdığı ve Hayri Esen'in seslendirdiği Halil adlı karakterden dinlediğiniz konuşma Metin Erksan'ın yönettiği hangi filmde geçmektedir?,"['A) Gelin', 'B) Sevmek Zamanı', 'C) Sultan', 'D) Selvi Boylum Al Yazmalım']",B,B,Sanat,7,50000.0,yok,True,False
C1idIOs806k,Contestant_117,"Postu siyah çubuklarla ve beneklerle süslü, kül renginde veya boz olan kedi anlamına gelen tekir kelimesinin kökeninin anlamı nedir?","['A) Toprak', 'B) Kaplan', 'C) benzersiz', 'D) desenli']",B,B,Genel Kültür,8,100000.0,yok,True,False
C1idIOs806k,Contestant_117,"Koyu kırmızı renkte, iri ve etli bir kiraz türü olan Napolyon kirazı adını hangisinden almıştır?","[""A) İtalya'nın Napoli şehrinden"", ""B) Fransa İmparatoru 1. Napolyon'dan"", ""C) Bursa'nın Uluabat Gölü'nden"", 'D) Bir çikolata türünden']",C,B,Genel Kültür,9,200000.0,telefon,False,True
C1idIOs806k,Contestant_118,Tekerlemeye göre kim kime bir berber dükkanı açmayı teklif eder?,"['A) Bir arkeolog bir arkeoloğa', 'B) bir eczacı bir eczacıya', ""C) Bir YouTuber bir YouTuber'a"", 'D) Bir berber bir berbere']",D,D,Genel Kültür,1,2000.0,yok,True,False
C1idIOs806k,Contestant_118,Motorlu taşıtların ön camlarında hangi şıkta yer alan bulunur?,"['A) Yaz', 'B) Çizecek', 'C) Bozacak', 'D) Silecek']",D,D,Genel Kültür,2,5000.0,yok,True,False
C1idIOs806k,Contestant_118,"Cümle alem, dünya alem, 7'den 70'e, 7 mahalle, 7 düvel kelimeleriyle eş anlamlı olan hangisidir?","['A) Herkes', 'B) kimsecik', 'C) Bazısı', 'D) birisi']",A,A,Genel Kültür,3,7500.0,yok,True,False
C1idIOs806k,Contestant_118,Resmi spor müsabakalarında genellikle hangileri eldiven giyer?,"['A) voleyboldaki pasörler', 'B) basketboldaki pivotlar', 'C) futboldaki kaleciler', 'D) tenisteki kule hakemleri']",C,C,Spor,4,10000.0,yok,True,False
C1idIOs806k,Contestant_118,Ankara'ya iniş yapan bir uçağın yolcuları hangi havalimanında olabilir?,"['A) Şakir Paşa', 'B) Sabiha Gökçen', 'C) Ercan', 'D) Esenboğa']",D,D,Coğrafya,5,20000.0,yok,True,False
C1idIOs806k,Contestant_118,Yahya Kemal Beyatlı'nın Sessiz Gemi şiirinde 'Artık Demir Almak Günü gelmişse zamandan' dizesinden sonra hangisine giden bir geminin limandan kalktığı söylenir?,"['A) Merhuma', 'B) Meçhule', 'C) Mevcuda', 'D) Meskene']",B,B,Edebiyat,6,30000.0,yok,True,False
C1idIOs806k,Contestant_118,Dinlediğiniz Hero adlı şarkıyı seslendiren kimdir?,"['A) Enrique Iglesias', 'B) Marc Anthony', 'C) Ricky Martin', 'D) Justin Timberlake']",A,A,Müzik,7,50000.0,telefon,True,False
C1idIOs806k,Contestant_118,Hoşaf kelimesinin kökeninin anlamı nedir?,"['A) Kuru meyve', 'B) Tatlı su', 'C) Yüzen üzüm', 'D) Güzel söz']",B,A,Genel Kültür,8,100000.0,yok,False,True
